ID,Text,Comment
AnalyticsConsent.Agree,ตกลง ฉันยินยอม,
AnalyticsConsent.Disagree,ไม่ตกลง ฉันไม่ยินยอม,
AnalyticsConsent.Header,ข้อมูลการเล่นเกม,Header of the panel that allows the player to consent to sending user data to the developers.
AnalyticsConsent.Info,"โปรดช่วยเราปรับปรุงเกมให้ดีขึ้นด้วยการแบ่งปันข้อมูลวิธีการเล่น Timberborn ของคุณ

หากคุณยินยอม เราจะรวบรวมข้อมูลที่เกี่ยวข้องกับการเล่นเกมในเซสชันการเล่นของคุณโดยอัตโนมัติ

คุณสามารถไปที่การตั้งค่าในเกมเพื่อเพิกถอนความยินยอมและลบข้อมูลของคุณได้ทุกเมื่อ หากต้องการข้อมูลเพิ่มเติม โปรดดูที่<link><u>นโยบายความเป็นส่วนตัว</u></link>ของเรา

ขอขอบคุณ!",
Attractions.LoadRate,ความนิยม,Header above a panel showing how popular an attraction is in each hour during the day
Attractions.Visitors,ผู้เยี่ยมชม,"A header above a list of beavers visiting an attraction, such as a campfire."
Attractions.VisitorsLimit,ผู้เยี่ยมชม: {0},{0} stands for capacity. Tells players the max capacity of the attraction in a shorter way
Autosave.Failure,บันทึกอัตโนมัติไม่สำเร็จ,Notification on top of the window when autosave failed. It disappears after 10 seconds
Autosave.FailureDueToFullDisk,บันทึกอัตโนมัติไม่สำเร็จเนื่องจากมีพื้นที่ดิสก์ไม่เพียงพอ,Notification on top of the window when autosave failed. It disappears after 10 seconds
Autosave.Success,บันทึกอัตโนมัติแล้ว,"Notification on top of the window when autosave succeeded. Keep short, it disappears after 2 seconds"
BatchControl.Distribution,การกระจาย,Title of the distribution panel
BatchControl.Housing,ที่อยู่อาศัย,Tooltip of a tab allowing to manage housing buildings.
BatchControl.Mechanical,พลังงาน,Tooltip of a tab allowing to manage mechanical buildings. Power must be the same as used in Mechanical.PowerInput and other Mechanical. keys.
BatchControl.Migration,การอพยพ,Title of migration panel
BatchControl.NoDistrict,ไม่ได้เลือกเขต,Shown when no district is selected on some batch control tabs
BatchControl.Population,ประชากร,Tooltip of a tab allowing to manage population.
BatchControl.ShowInfo,จัดการถิ่นฐาน,Button opening a window to view and manage multiple buildings and characters at once . Please keep short
BatchControl.Storage,ที่เก็บของ,Tooltip of a tab allowing to manage warehouses.
BatchControl.Workplaces,ที่ทำงาน,Tooltip of a tab allowing to manage workplaces.
Beaver.Adult.TemplateName,บีเวอร์โตเต็มวัย,
Beaver.Adulthood,วัยโตเต็มวัย,Next to a progress bar that shows when a baby beaver reaches adulthood.
Beaver.Age,อายุ: {0},"{0} stands for number of days, for example 'Age: 5'."
Beaver.Child.TemplateName,ลูกบีเวอร์,
Beaver.DeadNameSuffix,(ตาย),Preceded by beaver name and age
Beaver.DiedOldAge,{0}ตายจากวัยชรา,{0} stands for beaver name
Beaver.Employment,การจ้างงาน,Header of a section that tells of how many and where beavers are working
Beaver.GrewUp,{0} โตเต็มวัยแล้ว,{0} stands for beaver name. A notification that a beaver achieved maturity.
Beaver.Homeless,ไร้บ้าน,Signifies that the beaver has no home
Beaver.HomelessPlural,ไร้บ้าน,Label before number of homeless beavers
Beaver.House,อาศัยใน: {0},{0} stands for Building.DisplayName. Tells which type of building the beaver resides in.
Beaver.Launched,เปิดใช้ {0} แล้ว,{0} stands for beaver name. A notification that a beaver has been launched in a plane.
Beaver.PluralDisplayName,บีเวอร์,
Beaver.Population.Adults,โตเต็มวัย,Label before number of adult beavers
Beaver.Population.Children,ลูกบีเวอร์,Label before number of kit beavers
Beaver.Population.Contaminated,ปนเปื้อน,Header of the list of beavers contaminated by badwater. Should be similar or same as Need.BadwaterContamination.DisplayName
Beaver.Population.ContaminatedAdults,บีเวอร์โตเต็มวัยที่ปนเปื้อน,"Label before number of adult beavers contaminated by badwater. ""Contaminated"" should be similar or same as Need.BadwaterContamination.DisplayName. Ideally all uses of the word contaminate/contamination/contaminated should be uniform across the project."
Beaver.Population.ContaminatedChildren,ลูกบีเวอร์ที่ปนเปื้อน,"Label before number of children beavers contaminated by badwater. ""Contaminated"" should be similar or same as Need.BadwaterContamination.DisplayName. Ideally all uses of the word contaminate/contamination/contaminated should be uniform across the project."
Beaver.Unemployed,ว่างงาน,"Signifies that the beaver has no job, singular"
Beaver.UnemployedPlural,ว่างงาน,"Used in population statistics, followed by the number of unemployed beavers"
Beaver.Workplace,ทำงานที่: {0},{0} stands for Building.DisplayName. Tells which type of building the beaver works in.
Bonus.CarryingCapacity,ปริมาณที่ขนได้,How much stuff a unit can carry
Bonus.CuttingSuccessChance,โอกาสในการตัด,Cutting chance when cutting down a tree
Bonus.GrowthSpeed,ความเร็วในการเติบโต,Speed at which young beavers grow up
Bonus.LifeExpectancy,อายุขัย,The presumed length of beavers' life.
Bonus.MovementSpeed,ความเร็วในการเคลื่อนที่,"Describes how fast character can move (bonus to walking, running and swimming)."
Bonus.WorkingSpeed,ความเร็วในการทำงาน,Speed at which the beavers work.
Bot.BeaversPerished,"อย่าให้ฉันพูดถึงบีเวอร์เลย
พวกเขาเคยมีทุกอย่าง ทั้งอากาศบริสุทธิ์ น้ำสะอาด
ตอนนี้กลับกลายเป็นเพียงความทรงจำอันเลือนราง","Text for a game over state, when all beavers have perished."
Bot.Created,สร้าง{0}แล้ว!,{0} stands for bot name. Notification that shows when production of a new bot finishes.
Bot.DeadNameSuffix,(ถูกทำลาย),Preceded by bot name and age
Bot.DeathMessage,{0}เสียแล้ว,{0} stands for bot name. Notification that shows when a bot breaks down completely (it's destroyed)
Bot.DisplayName.Folktails,ทิมเบอร์บอท {0},{0} stands for a bot serial number. Name of bots from the Folktails faction. Named after the fact they are visibly made from wood.
Bot.DisplayName.IronTeeth,ไอรอนบอท {0},{0} stands for a bot serial number. Name of bots from the Iron Teeth faction. Named after the fact they are visibly made from metal.
Bot.Durability,ความทนทาน,Label before a progress bar showing amount of durability left
Bot.PluralDisplayName,บอท,"Bots are autonomous robots, who assist beavers in their everyday tasks. They are constructed in factories."
Bot.TemplateName,บอท,A bot is an animated anthropomorphic being which is created from inanimate matter. Timberborn bots are depicting beavers and are made of wood and metal.
Breeding.NutrientBringing,นักลาก บีเวอร์ว่างงาน และแรงงานจะนำสารอาหารมาให้หลังเลิกงาน,"Haulers are the same as in Building.HaulingPost.Description, unemployed as in Beaver.UnemployedPlural, workers as in Work.WorkersLabel"
Breeding.NutrientsNeeded,สารอาหารที่จำเป็น:,Followed by a list of nutrients needed to produce a new beaver in breeding facility
Breeding.Progress,ความคืบหน้าของการเพาะพันธุ์,Label inside a progress bar describing production progress of new beaver in breeding facility
BuilderPriorityTool.Description,ใช้เครื่องมือนี้เพื่อกำหนดลำดับความสำคัญของการก่อสร้าง การรื้อถอน และการรวบรวมสิ่งของจากซากอาคาร,Rubble should be plural version of RecoveredGoodStack.DisplayName
BuilderPriorityTool.Tip,คลิกไอเท็มเพื่อกำหนดลำดับความสำคัญหรือกดปุ่มค้างเพื่อเลือกพื้นที่ใหญ่ขึ้น,
Building.AdvancedBreedingPod.Description,ใช้กระบวนการเพาะพันธุ์ขั้นสูงเพื่อสร้างบีเวอร์โตเต็มวัยที่กระตือรือร้นจะทำงาน,Breeding should be the same as Building.BreedingPod.DisplayName
Building.AdvancedBreedingPod.DisplayName,ถังเพาะพันธุ์ขั้นสูง,
Building.AdvancedBreedingPod.FlavorDescription,ความคิดนี้ได้มาจากตอนที่ลูกบีเวอร์ตกลงไปในหม้อใบยักษ์ที่เต็มไปด้วยสารสกัด และเติบโตขึ้นอย่างรวดเร็วครั้งใหญ่หลังจากดื่มสารทั้งหมดนั้นเข้าไป,"Extract must be the same as Good.Extract.DisplayName, kit is a young beaver."
Building.Agora.Description,พื้นที่ขนาดใหญ่ที่บีเวอร์สามารถมาพูดคุยเรื่องไม้ๆ กันได้,
Building.Agora.DisplayName,จุดรวมพล,
Building.Agora.FlavorDescription,ไฟสัญญาณสีเขียวที่สว่างขึ้นเป็นสัญญาณให้ชาวหางไม้รวมตัวกัน,Folktails must be same as faction as Faction.Folktails.DisplayName.
Building.AncientAquiferDrill.DisplayName,แท่นเจาะชั้นหินอุ้มน้ำโบราณ,
Building.AquaticFarmhouse.Description,ว่าจ้างเกษตรกรที่ชำนาญเฉพาะด้านเพื่อปลูกและเก็บเกี่ยวพืช<YellowHighlight>น้ำ</YellowHighlight>,"Aquatic is a keyword, must be the same as in NaturalResources.Aquatic."
Building.AquaticFarmhouse.DisplayName,โรงเรือนพืชน้ำ,A farmhouse that specializes in water plants.
Building.AquaticFarmhouse.FlavorDescription,"""เคยมีข่าวลือว่าพวกเรากินปลา ช่างน่าขยะแขยง!"" —มา โกเนล","Beavers eating fish is a common misconception. Beavers are 100% herbivores. Ma' Ngonel is an almost legendary figure - a beaver grandma, known for her stern hand, cooking skills and respect among both kits and adult beavers. Her name is an inside joke, as our community constantly demands an addition of catapults, mangonels etc."
Building.Aquifer.Description,แหล่งน้ำที่อยู่ใต้ดิน,
Building.Aquifer.DisplayName,ชั้นหินอุ้มน้ำ,
Building.AquiferDrill.Description,สกัดน้ำจากชั้นหินอุ้มน้ำ,
Building.AquiferDrill.DisplayName,แท่นเจาะชั้นหินอุ้มน้ำ,
Building.BadtideDrain.Description,ปล่อยระบายน้ำเสียในช่วงฤดูน้ำเสียหลาก,
Building.BadtideDrain.DisplayName,ท่อระบายน้ำเสีย,
Building.BadwaterDischarge.Description,ช่วยปิดกั้นแหล่งน้ำเสีย สามารถเปิดปิดได้ เมื่อเปิดแล้ว น้ำเสียจะยังคงไหลอยู่แม้เข้าช่วงฤดูแล้ง,"Badwater Source must be the same as Building.BadwaterSource.DisplayName, Badwater must be the same as Good.Badwater.DisplayName."
Building.BadwaterDischarge.DisplayName,ตัวปล่อยน้ำเสีย,"Name of the building that can either stop flow of badwater or enforce flow with full power. It's a dome shaped, mechanical building that opens and closes like a camera shutter. Badwater must be the same as Good.Badwater.DisplayName."
Building.BadwaterDischarge.FlavorDescription,อนุญาตให้เข้าใกล้เฉพาะวิศวกรโยธาตัวจริงเท่านั้น,This is a reference to a youtuber called Real Civil Engineer.
Building.BadwaterDome.Description,ช่วยปิดกั้นแหล่งน้ำเสีย สามารถเปิดหรือปิดได้ตามต้องการ,"Badwater Source must be the same as Building.BadwaterSource.DisplayName, Badwater must be the same as Good.Badwater.DisplayName."
Building.BadwaterDome.DisplayName,โดมน้ำเสีย,Name of the building that stops flow of badwater when put on its source. It's a dome shaped mechanical building that can open and close by raising the cover up and down. Badwater must be the same as Good.Badwater.DisplayName.
Building.BadwaterDome.FlavorDescription,ไม่มีน้ำเสีย ไม่ต้องเสียใจ,"This is a reference to a Bob Marley song ""No woman, no cry""."
Building.BadwaterPump.Description,ปั๊มเสริมแรงดันที่สามารถปั๊มน้ำเสียออกได้ การปนเปื้อนน้ำเสียในระดับที่ต่ำจะทำให้ความเร็วในการปั๊มลดลง,Badwater should be the same as Good.Badwater.DisplayName. Ideally all uses of the word contaminate/contamination/contaminated should be uniform across the project.
Building.BadwaterPump.DisplayName,ปั๊มน้ำเสีย,Badwater should be the same as Good.Badwater.DisplayName.
Building.BadwaterPump.FlavorDescription,"""ฉันหวังว่ามาตรการป้องกันเพิ่มเติมจะมีที่อุดจมูกให้ด้วย"" —ซูลี",Suli is a younger beaver that likes to play tricks on their fellow beavers and isn't related to any faction in particular. Translated name shouldn't suggest a gender if possible.
Building.BadwaterRig.Description,ช่วยปิดกั้นแหล่งน้ำเสีย ใช้แรงงานเพื่อตักน้ำเสียออกจากแหล่งน้ำโดยตรง,"Badwater Source must be the same as Building.BadwaterSource.DisplayName, Badwater must be the same as Good.Badwater.DisplayName."
Building.BadwaterRig.DisplayName,เครื่องกำจัดน้ำเสีย,Name of the building that stops flow from badwater source and generates Good.Badwater.DisplayName goods (by extracting them from source). It's a mechanical building that needs workers to operate. Badwater must be the same as Good.Badwater.DisplayName
Building.BadwaterRig.FlavorDescription,เหล่าบีเวอร์ที่ทำงานอยู่เหนือแหล่งน้ำเสียที่กำลังปะทุรู้สึกถึงแรงกดดันอันต่อเนื่อง,Play on words with pressure referring to both water pressure and stress. If possible try to adapt the phrase to fit your language.
Building.BadwaterSeep.Description,แหล่งน้ำเสียที่มีแรงดันจำกัด,
Building.BadwaterSeep.DisplayName,แหล่งน้ำเสียซึม,"A building that allows badwater to seep through, creating a natural badwater source."
Building.BadwaterSource.DisplayName,แหล่งน้ำเสีย,A crack or spring in the ground spuming badwater. Badwater should be the same as Good.Badwater.DisplayName.
Building.BadwaterSource.FlavorDescription,"""ทำไมเราถึงต้องเก็บกวาดเศษซากของมานุดด้วย อ๋อ จริงด้วย เพราะพวกนั้นตายกันไปหมดแล้วไง""—พีนา",
Building.Bakery.Description,อบขนมปังและขนมอบจากแป้งชนิดต่างๆ,Pastry being a baked good.
Building.Bakery.DisplayName,เตาอบขนม,Building that bakes bread
Building.Bakery.FlavorDescription,"""จะมีอะไรดีไปกว่าขนมปังร้อนๆ โรยขี้เลื่อยเล็กน้อยกันละ"" —มา โกเนล","Ma' Ngonel is an almost legendary figure - a beaver grandma, known for her stern hand, cooking skills and respect among both kits and adult beavers. Her name is an inside joke, as our community constantly demands an addition of catapults, mangonels etc."
Building.Barrack.Description,ที่อยู่อาศัยร่วมกันที่ใช้งานได้จริง,
Building.Barrack.DisplayName,ห้องพัก,Barracks are cramped homes for beavers. Not related to soldiers.
Building.Barrack.FlavorDescription,"""ชาวหางไม้สองตัวเดินเข้ามาในค่ายทหาร"" —มุกตลกของชาวเขี้ยวเหล็ก","Reference to 'walk into a bar' jokes; only Iron Teeth use Barracks, as Folktails prefer different lodges and are less work-focused than Iron Teeth"
Building.BeaverBust.Description,รูปปั้นครึ่งตัวของบีเวอร์ผู้ดูมีความสำคัญ,
Building.BeaverBust.DisplayName,รูปปั้นครึ่งตัวบีเวอร์,
Building.BeaverBust.FlavorDescription,ลูกบีเวอร์แสนซนชอบเติมแต่งใบหน้าของโอล แคซโก,"Ol' Kazko is a legendary forefather of modern beavers, famous inventor, pioneer of rapid industrialization. Kits are young beavers."
Building.BeaverStatue.Description.Folktails,รูปแกะสลักบีเวอร์ที่อ้วนท้วนสมบูรณ์,
Building.BeaverStatue.Description.IronTeeth,รูปแกะสลักบีเวอร์ที่ขยันขันแข็ง,
Building.BeaverStatue.DisplayName,รูปแกะสลักบีเวอร์,Statue of a beaver
Building.BeaverStatue.FlavorDescription.Folktails,ทำให้คุณรู้สึกภูมิใจในปีที่ผลผลิตดีและรู้สึกหิวในปีที่ผลผลิตแย่,The statue shows a beaver with a full belly so it can make one hungry when looking at it.
Building.BeaverStatue.FlavorDescription.IronTeeth,รูปแกะสลักต้นแบบที่ถือเคียวดูเหมือนพวกชาวหางไม้มากเกินไป,This metal statue depicts a beaver worker with a raised hammer. Hammer and sickle is an emblem of Soviet Russia. Folktails must be same as faction name (Faction.Folktails.DisplayName).
Building.Beehive.Description,ช่วยเร่งการเจริญเติบโตของพืชโดยรอบ,
Building.Beehive.DisplayName,รังผึ้ง,
Building.Beehive.FlavorDescription,"""เดี๋ยวเธอก็จะชินเสียงบินหึ่งๆ ไปเอง"" —มา โกเนล","Ma' Ngonel is an almost legendary figure - a beaver grandma, known for her stern hand, cooking skills and respect among both kits and adult beavers. Her name is an inside joke, as our community constantly demands an addition of catapults, mangonels etc."
Building.Bell.Description,ดังเมื่อเริ่มต้นและสิ้นสุดวันทำงาน,This is a large metal bell that rings twice a day.
Building.Bell.DisplayName,ระฆัง,A large metal bell
Building.Bell.FlavorDescription,"""เธอควรจะเฝ้ารอคอยเสียงระฆังในตอนเช้าต่างหาก"" —โอล แคซโก","Ol' Kazko is a legendary forefather of modern beavers, famous inventor, pioneer of rapid industrialization."
Building.Bench.DisplayName,ม้านั่ง,
Building.Bench.FlavorDescription,บางครั้งพวกชอบทำลายข้าวของก็จะมากินทรัพย์สินสาธารณะ,
Building.Blockage.Description,คันกั้นน้ำตามธรรมชาติ สามารถรื้อถอนได้,Demolished meaning removed by a worker.
Building.Blockage.DisplayName,คันกั้นน้ำ,"Not a dam since that's another building in game but if not possible it could be called a Natural Dam. Visually, it's a block made out of twigs and loose stones."
Building.Blockage.FlavorDescription,เป็นเรื่องยากที่จะเชื่อว่าสมัยก่อนเราใช้แค่โคลนกับกิ่งไม้เพื่อสร้างเขื่อน,
Building.BotAssembler.Description,ประกอบบอทอัตโนมัติซึ่งสามารถช่วยบีเวอร์ทำงานประจำวันต่างๆ ได้,Bots should be the same as Bot.PluralDisplayName
Building.BotAssembler.DisplayName,โรงประกอบบอท,A factory for assembling bots. Bot should be the same as Bot.TemplateName
Building.BotAssembler.FlavorDescription,"ทุกอย่างเริ่มต้นจากความคิดง่ายๆ ว่า ""จะเป็นยังไงถ้าฉันไม่ต้องทำงานวันนี้"" —พีนา",
Building.BotPartFactory.Description,ผลิตชิ้นส่วนบอท,Bot should be the same as Bot.TemplateName
Building.BotPartFactory.DisplayName,โรงงานชิ้นส่วนบอท,"A factory for creating bot parts, that are later assembled into full bots. Bot should be the same as Bot.TemplateName."
Building.BotPartFactory.FlavorDescription,"""เสร็จแล้ว! เดี๋ยวนะ มีตะปูเกลียวเหลืออยู่ตรงนี้ได้ยังไง"" —พีนา",
Building.Brazier.Description,ไฟที่ลุกโชนอยู่ในเตาประดับอย่างปลอดภัย,
Building.Brazier.DisplayName,เตาไฟ,
Building.Brazier.FlavorDescription,"""โว้ว เพลิงลุกโชน"" —ซูลี",Play on words with lit meaning both lit up and cool. If possible try to adapt the phrase to fit your language. Suli is a younger beaver that likes to play tricks on their fellow beavers and isn't related to any faction in particular. Translated name shouldn't suggest a gender if possible.
Building.BrazierOfBonding.DisplayName,เตาไฟแห่งการหลอมรวม,A large brazier surrounded by statues of a beaver family
Building.BrazierOfBonding.FlavorDescription,"""ถ้าเราไม่ได้ใช้ บีเวอร์รุ่นต่อไปก็คงจะได้ใช้"" —มา โกเนล","Ma' Ngonel is an almost legendary figure - a beaver grandma, known for her stern hand, cooking skills and respect among both kits and adult beavers. Her name is an inside joke, as our community constantly demands an addition of catapults, mangonels etc."
Building.BreedingPod.Description,วิธีการขยายพันธุ์เพียงวิธีเดียวที่พวกเขี้ยวเหล็กชื่นชอบ,Iron Teeth must be the same as the faction name (Faction.IronTeeth.DisplayName).
Building.BreedingPod.DisplayName,ถังเพาะพันธุ์,
Building.BreedingPod.FlavorDescription,"""ลูกคืออนาคตของเรา เราต้องการอีกสิบสองตัวภายในเดือนหน้า"" —โอล แคซโก","Ol' Kazko is a legendary forefather of modern beavers, famous inventor, pioneer of rapid industrialization."
Building.BuildersHut.Description,ใช้ช่างก่อสร้างเพิ่มเติม,
