ID,Text,Comment
NaturalResource.Wheat.DisplayName,ข้าวสาลี,Plant Triticum aestivum
NaturalResource.Wheat.FlavorDescription,“คุณจะลืมดวงอาทิตย์บนท้องฟ้าสดใส เมื่อเราเดินไปในทุ่งทองคำ” —เพลงช้าของบีเวอร์,"Adapted from ""Fields of Gold"" by Sting."
NaturalResources.Aquatic,<YellowHighlight>พืชน้ำ</YellowHighlight>: ต้องจมอยู่ในน้ำบางส่วน,Aquatic is a keyword. Shown after selecting an aquatic plant. Examples of aquatic plants include spadderdock or water lilies.
NaturalResources.DaysToDie,ตายใน: {0} วัน,"Shown when natural resource is dying (from any reason), {0} stands for number of days left to die"
NaturalResources.DiedFromContamination,ตายจากการปนเปื้อน,Shown when a plant died after being contaminated for too long. Ideally all uses of the word contaminate/contamination/contaminated should be uniform across the project. Please keep short.
NaturalResources.DiedFromNotEnoughWater,ตายจากการพ้นน้ำ,Shown when a water plant died after not being submerged in water for too long. Please keep short.
NaturalResources.DiedFromTooMuchWater,ตายจากการจมน้ำ,Shown when a plant died after it had been submerged in water for too long. Please keep short.
NaturalResources.Dried,แห้งตาย,Shown for plants which died from lack of water. Please keep short.
NaturalResources.DroughtResistance,ความทนต่อฤดูแล้ง: {0} วัน,The number of days a plant can survive in a drought.
NaturalResources.GenericDied,ตาย,Refers to a plant.
NaturalResources.Healthy,ได้รับน้ำและแข็งแรงดี,Shown when plant is healthy and has no problems with growth
NaturalResources.Leftover,{0} (ยังไม่ได้เก็บ),{0} stands for NaturalResource.DisplayName. Leftover meaning plant that was cut but not yet collected.
NaturalResources.Mature,{0} (โตเต็มที่),{0} stands for NaturalResource.DisplayName. Fully grown plant.
NaturalResources.Seedling,{0} (ต้นอ่อน),{0} stands for NaturalResource.DisplayName. Not fully grown plant.
NaturalResources.Visibility.Hide,ซ่อนทรัพยากรธรรมชาติ,Tooltip for button hiding natural resources
NaturalResources.Visibility.Show,แสดงทรัพยากรธรรมชาติ,Tooltip for button showing natural resources
Need.BadwaterContamination.DisplayName,การปนเปื้อน,Title of an effect that shows up when a beaver is contaminated. Ideally all uses of the word contaminate/contamination/contaminated should be uniform across the project.
Need.BeeSting.DisplayName,ผึ้งต่อย,Title of an effect that shows up when a beaver has been stung by a bee.
Need.ChippedTeeth.DisplayName,ฟันบิ่น,Title of an effect that shows up when a beaver has chipped its teeth
Need.Hunger.DeathMessage,หิวตาย,Preceded by beaver name.
Need.Hunger.DisplayName,ความหิว,Title of a beaver need related to its hunger
Need.Injury.DisplayName,การบาดเจ็บ,Title of an effect that shows up when a beaver has been injured
Need.Power.DisplayName,พลังงาน,A need satisfied when a bot recharges.
Need.Roof.DisplayName,หลังคา,"Same as Building.Roof2x2.DisplayName without the size. It refers to roofs as one of the available decorations, do not confuse with Shelter which is a separate need."
Need.Shelter.DisplayName,ที่พัก,A need that is fulfilled when a beaver has a house.
Need.Sleep.DisplayName,นอนหลับ,A need satisfied when a beaver sleeps.
Need.Thirst.DeathMessage,ตายจากความกระหาย,Preceded by beaver name
Need.Thirst.DisplayName,ความกระหาย,A need satisfied by providing water.
Need.WetFur.DisplayName,ขนเปียก,An effect that occurs when a beaver enters water and is wet. It's a positive effect and it stays for a time after the beaver leaves water.
NeedGroup.Aesthetics.DisplayName,สุนทรียภาพ,"Name of a need group where needs are satisfied by decorating your settlement, previously Need.Esthetics.DisplayName"
NeedGroup.Awe.DisplayName,ความน่าเกรงขาม,Same as the Need named Awe
NeedGroup.BasicNeeds.DisplayName,ความต้องการพื้นฐาน,"A group of needs which includes needs such as Hunger, Water, Shelter etc."
NeedGroup.Boosts.DisplayName,ตัวเร่ง,Name of a group containing boosting effects for bots
NeedGroup.Fun.DisplayName,ความสนุก,"Name of a need group where needs are satisfied by building attractions for the beavers, previously Need.Fun.DisplayName"
NeedGroup.Happiness.DisplayName,ความสุข,General happiness of the populace
NeedGroup.Knowledge.DisplayName,ความรู้,"Name of a need group where needs are satisfied when beavers learn new stuff, previously Need.Knowledge.DisplayName"
NeedGroup.Nutrition.DisplayName,สารอาหาร,Same as the need named Nutrition
NeedGroup.SocialLife.DisplayName,การเข้าสังคม,"Name of a need group where needs are satisfied by letting beavers be social and chat with other beavers, previously Need.SocialLife.DisplayName"
NeedGroup.Temporary.DisplayName,ผลชั่วคราว,"Name of a need group containing temporary effects, both positive and negative."
Needs.Beaver.DeathWarning,บีเวอร์จะตายในไม่ช้า,
Needs.HeatProtection,ปกป้องจาก: {0},"Shown on a tooltip, when need protects from heat effects. {0} stands for heat effect name."
Needs.InRange,ภายใน {0} ช่อง,"{0} stands for radius size (area of effect), text is shown after Need.DisplayName to indicate its radius"
Needs.SatisfiesInRange,เติมเต็ม{0}ในรัศมี {1} ช่อง,{0} stands for Need.DisplayName {1} stands for radius size (area of effect)
NewGame.Notification,พบแหล่งไม้และสายน้ำแล้ว เป็นสัญญาณการเริ่มต้นครั้งใหม่,Notification when a new game is started
NewGameConfigurationPanel.Aged,อายุ,"Describing age of beavers, between text fields, example: 'Starting beavers: [20] aged [10]'"
NewGameConfigurationPanel.BadtideDuration,ระยะเวลาของฤดูน้ำเสียหลาก,"Label of a setting, how long badtide season could be. Badtide should be the same as Weather.Badtide"
NewGameConfigurationPanel.BadtideDurationHandicap,การลดระยะเวลาของฤดูน้ำเสียหลาก,"Label of a setting, makes badtide season shorter during a game, example usage: 'Badtide duration handicap: 50%. Badtide should be the same as Weather.Badtide"
NewGameConfigurationPanel.ChanceForBadtide,โอกาสที่จะเกิดฤดูน้ำเสียหลาก,"Label of a setting, what is the chance for a badtide season. Badtide should be the same as Weather.Badtide"
NewGameConfigurationPanel.Custom,กำหนดเอง,Game mode keep short
NewGameConfigurationPanel.Customize,ปรับแต่ง,Label of the button that opens the customization panel.
NewGameConfigurationPanel.Cycles,รอบฤดูกาล,"Cycle is a unit of time shown after a number, example usage: '10 cycles'. Must be consistent with Weather.CycleAndDayLong."
NewGameConfigurationPanel.CyclesBeforeBadtideRandomization,รอบฤดูกาลโดยไม่มีฤดูน้ำเสียหลาก,"Label of a setting, how many cycles there will be without badtide seaon possibility. Badtide should be the same as Weather.Badtide"
NewGameConfigurationPanel.Days,วัน,"Shown after a number field, example usage: '10 days'"
NewGameConfigurationPanel.DemolishableRecoveryRate,อัตราการคืนของจากสิ่งก่อสร้าง,"Label of a setting, defines how much goods user will get back after demolishing a building, example usage: 'Building refund rate: 75%'"
NewGameConfigurationPanel.DroughtDuration,ระยะเวลาของฤดูแล้ง,"Label of a setting, how long drought is during each cycle."
NewGameConfigurationPanel.DroughtDurationHandicap,การลดระยะเวลาของฤดูแล้ง,"Label of a setting, makes droughts shorter during a game, example usage: 'Drought duration handicap: 50%"
NewGameConfigurationPanel.Easy,ง่าย,Game mode keep short
NewGameConfigurationPanel.EasyModeDescription,"คุณยังคงอยู่ในช่วงเรียนรู้หรือต้องการเล่นเกมสร้างเมืองที่ผ่อนคลาย

ถิ่นฐานของคุณจะเริ่มต้นมาด้วยทรัพยากรที่อุดมสมบูรณ์

บีเวอร์กินอาหารและน้ำน้อยกว่า

ฤดูแล้งและฤดูน้ำเสียหลากเกิดขึ้นน้อยมากและกินระยะเวลาสั้นๆ",Badtide should be the same as Weather.Badtide
NewGameConfigurationPanel.EnableBadtides,ฤดูน้ำเสียหลาก,"Label of the checkbox that enables badtides, ""Badtides"" should be plural of Weather.Badtide."
NewGameConfigurationPanel.EnableDroughts,ฤดูแล้ง,"Label of the checkbox that enables droughts, ""Droughts"" should be plural of Weather.Drought."
NewGameConfigurationPanel.FoodConsumption,การบริโภคอาหาร,"Label of a setting, how much food beavers consume during a game. For example 'Food consumption: 60%'"
NewGameConfigurationPanel.For,นาน,"Specifies a duration, between text fields, example usage: 'Drought duration handicap: [50%] for [10] cycles'"
NewGameConfigurationPanel.Hard,ยาก,Game mode keep short
NewGameConfigurationPanel.HardModeDescription,"มนุษย์ไม่เหลือรอดและคุณก็จะไม่รอดเช่นกัน

ถิ่นฐานของคุณเริ่มต้นด้วยทรัพยากรที่หายาก

ฤดูแล้งและฤดูน้ำเสียหลากรุนแรงและเลวร้ายขึ้นเมื่อเวลาผ่านไป

ลับฟันให้คมไปอีกขั้น",Hard difficulty description. 'did not make it' as in they did not survive. 'sharpen your incisors' is meant to be a kind of a call to arms before a tough game. Badtide should be the same as Weather.Badtide
NewGameConfigurationPanel.InjuryChance,โอกาสบาดเจ็บ,"Label of a setting, how often injuries occur in workshops (relative to predefined value), example usage: 'Injury chance: 50%'. Injury must be the same as Need.Injury.DisplayName"
NewGameConfigurationPanel.Normal,ปกติ,Game mode keep short
NewGameConfigurationPanel.NormalModeDescription,"คุณต้องการความท้าทาย

ถิ่นฐานของคุณเริ่มต้นด้วยทรัพยากรในระดับปานกลาง

ฤดูแล้งและฤดูน้ำเสียหลากจะเบาลงในช่วงเริ่มต้น แต่จะรุนแรงขึ้นเมื่อเวลาผ่านไป", Badtide should be the same as Weather.Badtide
NewGameConfigurationPanel.Start,เริ่มต้น,A button starting the game please keep short
NewGameConfigurationPanel.StartingAdults,โตเต็มวัยเริ่มต้น,"Label of a setting, number of adults spawned at the start of a game."
NewGameConfigurationPanel.StartingChildren,ลูกบีเวอร์เริ่มต้น,"Label of a setting, number of children spawned at the start of a game."
NewGameConfigurationPanel.StartingFood,อาหารเริ่มต้น,"Label of a setting, amount of food available at the start of a game."
NewGameConfigurationPanel.StartingWater,น้ำเริ่มต้น,"Label of a setting, amount of water available at the start of a game."
NewGameConfigurationPanel.SubHeader,โหมดเกม,
NewGameConfigurationPanel.TemperateWeatherDuration,ระยะเวลาอากาศอบอุ่น,"Label of a setting, how long temperate weather is during each cycle."
NewGameConfigurationPanel.To,ถึง,"Describes a range of numbers, example usage: '20 to 50%'"
NewGameConfigurationPanel.WaterConsumption,การบริโภคน้ำ,"Label of a setting, how much water beavers consume during a game, for example 'Water consumption: 60%'."
NewGameFactionPanel.SubHeader,เลือกฝ่ายของคุณ,
NewGameMapPanel.SubHeader,เลือกแผนที่,
NewMapPanel.Header,สร้างแผนที่ใหม่,
Planting.NoPriorityOption,ไม่มี,No resource is prioritized
Planting.Prioritize,ทรัพยากรที่ได้รับความสำคัญ:,Which resource to prioritize when planting.
Planting.ReplantDeadTrees,ปลูกต้นไม้ซึ่งไม่ได้ทำเครื่องหมายไว้สำหรับการตัดที่ตายไปขึ้นใหม่,Label of toggle in forester panel fragment
Planting.UnlockPrompt,คุณต้องปลดล็อก{0}เพื่อปลูก{1},{0} stands for Building.DisplayName {1} stands for NaturalResource.DisplayName.
PlantingTool.Description,ใช้เครื่องมือนี้เพื่อกำหนดพื้นที่ปลูก,
PlantingTool.RequiredBuilding,สิ่งก่อสร้างที่จำเป็น: {0},{0} stands for Building.DisplayName.
PlayerData.CorruptedDataInfo.CorruptedFilePresent,คุณสามารถเรียกดูสำเนาของไฟล์ข้อมูลผู้เล่นที่เสียหายได้ใน<link><b>โฟลเดอร์เอกสารเกม</b></link>,Corrupted means broken or unusable due to some error.
PlayerData.CorruptedDataInfo.Header,มีปัญหาในการอ่านไฟล์ผู้เล่นของคุณ เราได้กู้คืนเนื้อหาจากการสำรองข้อมูลในเครื่องแล้ว แต่รายละเอียดบางอย่าง (รวมถึงฝ่ายที่ปลดล็อกและแผนที่ที่เชี่ยวชาญแล้ว) อาจสูญหาย,
Population.AllPerished,"และแม้บีเวอร์จะพินาศไปสิ้น แต่แม่น้ำก็ไหลต่อไป
มีชีวิตอยู่เพียงชั่วครู่ ก่อนจะกลายเป็นเศษผงไม้",UI information displayed as a tooltip when the entire population has died.
Priorities.VeryLow,ต่ำมาก,Please keep short
Priorities.Low,ต่ำ,Please keep short
Priorities.Normal,ปกติ,Please keep short
Priorities.High,สูง,Please keep short
Priorities.VeryHigh,สูงมาก,Please keep short
RecoverableGood.RecoveredGoods,สิ่งของที่เก็บคืนได้:,Label on tooltip that shows up when the player want to destroy building(s). Followed by list of goods.
RecoveredGoodStack.DeletePrompt,สิ่งของทั้งหมดในเศษชิ้นส่วนจะสูญหายไป คุณแน่ใจไหมว่าต้องการนำเศษชิ้นส่วนออก,"Prompt shown when the player clicks delete button on chosen rubble,Rubble should be the same as RecoveredGoodStack.DisplayName"
RecoveredGoodStack.Description,วัสดุที่หลงเหลือหลังจากรื้อถอนสิ่งก่อสร้าง ช่างก่อสร้างสามารถรวบรวมได้,Description of stack of goods spawned after destroying a building. Builders should be translated the same way as in Building.BuildersHut.Description key
RecoveredGoodStack.DisintegrationCountdown,สลายใน: {0} วัน,Info on rubble entity panel disintegration countdown progress bar
RecoveredGoodStack.DisplayName,ซากอาคาร,Display name of stack of goods spawned after destroying a building
RecoveredGoodStack.FlavorDescription,ไหนๆ ก็ขวางตาอยู่แล้ว,
RecoveredGoodStack.Priority,ลำดับความสำคัญในการรวบรวม:,Setting a priority for goods gathering work on a Rubble. Could be similar to Demolish.PriorityTitle
Resources.GatheredBy,รวบรวมโดย:,"Header above list of buildings that can gather certain resource. Gathered is meant as general term, containing resource gathering of gatherers, farmers, lumberjacks, tappers."
Ruins.ShuffleModel,แบบสุ่ม,Shuffle as in Randomize.
Saving.Autosave,บันทึกอัตโนมัติ,Name of the autosaved game
Saving.CycleUnknown,ไม่ทราบรอบฤดูกาล,"Text shown in old save games labels that don't have cycle information. ""Cycle"" should be the same as in Weather.CycleAndDayLong"
Saving.DeleteSave,ลบข้อมูลบันทึก,A button. Please keep short.
Saving.DeleteSavePrompt,คุณแน่ใจไหมว่าต้องการลบ{0},{0} stands for save name
Saving.DeleteSettlement,ลบถิ่นฐาน,A button. Please keep short.
Saving.DeleteSettlementPrompt,คุณแน่ใจไหมว่าต้องการลบถิ่นฐาน {0} การดำเนินการนี้จะลบข้อมูลบันทึกทั้งหมดของถิ่นฐาน,{0} stands for settlement name
Saving.Error,การบันทึกล้มเหลว! หลีกเลี่ยงการใช้อักขระที่ไม่อนุญาตและตรวจสอบให้แน่ใจว่ามีพื้นที่จัดเก็บเพียงพอ,Message shown to player when saving game or map failed
Saving.InvalidFile,"ข้อมูลบันทึกที่คุณกำลังพยายามโหลดเสียหาย!

ถิ่นฐาน: {0}
ข้อมูลบันทึก: {1}",Error message shown after trying to load a save file that is corrupted.
Saving.InvalidName,ชื่อไม่ถูกต้อง ตรวจสอบให้แน่ใจว่าชื่อไม่มีอักขระที่ผิดกฎ,Error message shown after inputting a settlement name with illegal characters such > < ?.
Saving.LoadGamePanelHeader,โหลดเกม,
Saving.MissingMacOSPermissionsLocKey,Timberborn ต้องได้รับสิทธิ์ในการจัดเก็บเกมที่บันทึกไว้ลงในอุปกรณ์ของคุณ ตอนนี้เกม Timberborn จะปิดลงและเปิดการตั้งค่าเพื่อให้คุณสามารถให้สิทธิ์ที่จำเป็นได้,A message shown to players if they did not grant the necessary permissions on macOS.
Saving.NameSettlement,คุณต้องการเรียกถิ่นฐานของคุณว่าอะไร,A prompt in the box for naming your settlement after starting a new game.
Saving.NonCompatibleSaveVersion,"ข้อมูลบันทึกนี้ใช้ร่วมกับเวอร์ชันปัจจุบันไม่ได้
เราพยายามหลีกเลี่ยงปัญหานี้อย่างเต็มที่แล้ว โปรดเริ่มเกมใหม่เพื่อเพลิดเพลินกับฟีเจอร์ใหม่ได้อย่างเต็มที่",
Saving.SaveExists,"ข้อมูลบันทึก ""{0}"" มีอยู่แล้ว",{0} stands for save name
Saving.SaveGamePanelHeader,บันทึกเกม,
Saving.Saves,ข้อมูลบันทึก,One of the two headers in the load game panel. Shown above a list of saves assigned to a settlement.
Saving.SemiCompatibleSaveVersion,"ข้อมูลบันทึกเวอร์ชัน ({0}) ใช้ร่วมกับเวอร์ชันปัจจุบันไม่ได้ ({1}) การโหลดข้อมูลบันทึกอาจทำให้เกิดการหยุดทำงานและเกิดปัญหาที่ทำให้เกมเสียหายได้ เราขอแนะนำเป็นอย่างยิ่งให้เริ่มเกมใหม่เพื่อเพลิดเพลินกับฟีเจอร์ใหม่ๆ ได้อย่างเต็มที่ 

คุณแน่ใจไหมว่าต้องการโหลด","{0} is the save version (e.g. 0.1.15.1), {1} is the game version (in the same format). This message is shown after a player tries to load an incompatible save."
Saving.Settlements,ถิ่นฐาน,One of the two headers in the load game panel. Shown above a list of settlements.
Saving.SteamCompatibilityMessage,<RedHighlight><i>คุณสามารถเล่นเกมเวอร์ชันเก่าได้โดยการสลับไปใช้เวอร์ชันที่กำหนดเองในโปรแกรม Steam</i></RedHighlight>,Additional message on Steam that is shown when the save is not compatible with the current version of the game. It is shown below Saving.SemiCompatibleSaveVersion and Saving.NonCompatibleSaveVersion messages.
Saving.TakenName,มีถิ่นฐานที่ใช้ชื่อนี้อยู่แล้ว,Error message shown after inputting a settlement name that is already used.
Science.SciencePoints,แต้มวิทยาศาสตร์,The name of a resource which can be spent to unlock new technology
Settings.Accessibility.DisableStarfieldRotation,ปิดการหมุนตามจุดสนใจ,Label for disabling starfield (stars in the night sky) rotation in accessibility settings
Settings.Accessibility.Header,การเข้าถึง,Header for accessibility section in settings panel
Settings.Analytics.ConsentToggle,เปิดใช้งานการวิเคราะห์แล้ว,Selected when giving consent to data collection/analytics.
Settings.Analytics.DataDeleted,ลบข้อมูลที่รวบรวมไว้แล้ว,Confirmation info that the collected data has been deleted.
Settings.Analytics.DeleteData,ลบข้อมูลที่รวบรวมไว้,Selected when withdrawing consent to data collection/analytics.
Settings.Analytics.Header,การวิเคราะห์,Header for the data collection/analytics consent section.
Settings.GameSaving.AutoSavingOn,บันทึกอัตโนมัติ,
Settings.GameSaving.Header,กำลังบันทึก,
Settings.Graphics.AnisotropicFiltering,ฟิลเตอร์คมชัดระยะไกล,Label for anisotropic textures quality option
Settings.Graphics.AnisotropicTextures,พื้นผิวคมชัดระยะไกล,Label for anisotropic textures quality option
Settings.Graphics.AntiAliasing.FXAA,FXAA,Label for FXAA anti-aliasing option in graphics settings panel
Settings.Graphics.AntiAliasing.MSAAx2,MSAA x2,Label for MSAA with x2 resolution anti-aliasing option in graphics settings panel
Settings.Graphics.AntiAliasing.MSAAx4,MSAA x4,Label for MSAA with x4 resolution anti-aliasing option in graphics settings panel
Settings.Graphics.AntiAliasing.MSAAx8,MSAA x8,Label for MSAA with x8 resolution anti-aliasing option in graphics settings panel
Settings.Graphics.AntiAliasing.MacMSAAWarning,อาจทำให้เกิดการแสดงผลผิดปกติในฮาร์ดแวร์รุ่นเก่าได้,Warning message for Mac users about potential artifacts when using MSAA anti-aliasing
Settings.Graphics.AntiAliasing.SMAA,SMAA,Label for SMAA anti-aliasing option in graphics settings panel
Settings.Graphics.AntiAliasingQuality,การลบรอยหยัก,Antialiasing dropdown label in graphics settings panel
Settings.Graphics.Bloom,ความฟุ้ง,Label for bloom effect dropdown in graphics settings panel
Settings.Graphics.Header,คุณภาพกราฟิก,Header for graphics quality section in settings panel
Settings.Graphics.LightQuality,คุณภาพแสง,Label for Light quality dropdown
Settings.Graphics.OverallGraphicsQuality,พรีเซ็ต,Label for graphics quality dropdown
Settings.Graphics.Quality.Custom,กำหนดเอง,Label for custom graphics quality option
Settings.Graphics.Quality.High,สูง,Label for high quality graphics option
Settings.Graphics.Quality.Low,ต่ำ,Label for low quality graphics option
