ID,Text,Comment
Good.BotHead.DisplayName,หัวบอท,A head of a bot. Bot should be the same as Bot.TemplateName.
Good.BotHead.PluralDisplayName,หัวบอท,A head of a bot. Bot should be the same as Bot.TemplateName.
Good.BotLimb.DisplayName,แขนขาบอท,An unspecified limb of a bot. Bot should be the same as Bot.TemplateName.
Good.BotLimb.PluralDisplayName,แขนขาบอท,An unspecified limb of a bot. Bot should be the same as Bot.TemplateName.
Good.Bread.DisplayName,ขนมปัง,A name of a good.
Good.Bread.PluralDisplayName,ขนมปัง,A name of a good.
Good.CanolaOil.DisplayName,น้ำมันคาโนลา,Canola should be the same as in Good.CanolaSeeds.DisplayName.
Good.CanolaOil.PluralDisplayName,น้ำมันคาโนลา,Canola should be the same as in Good.CanolaSeeds.DisplayName.
Good.CanolaSeeds.DisplayName,เมล็ดคาโนลา,An oil crop that grows tall and is full of yellow flowers.
Good.CanolaSeeds.PluralDisplayName,เมล็ดคาโนลา,An oil crop that grows tall and is full of yellow flowers.
Good.Carrot.DisplayName,แคร์รอต,Resource name
Good.Carrot.PluralDisplayName,แคร์รอต,Resource name
Good.Cassava.DisplayName,มันสำปะหลัง,"A root vegetable that's poisonous to eat raw, also known as manioc or yuca."
Good.Cassava.PluralDisplayName,มันสำปะหลัง,"A root vegetable that's poisonous to eat raw, also known as manioc or yuca."
Good.Catalyst.DisplayName,ตัวเร่งปฏิกิริยา,"A potent Biofuel reagent, allowing bots to work and move faster."
Good.Catalyst.PluralDisplayName,ตัวเร่งปฏิกิริยา,Plural form of Good.Catalyst.DisplayName
Good.CattailCracker.DisplayName,แครกเกอร์ธูปฤาษี,"Crackers made from flour made from roots of the plant of a genus Typha, keep plant name same as NaturalResource.Cattail.DisplayName"
Good.CattailCracker.PluralDisplayName,แครกเกอร์ธูปฤาษี,"Crackers made from flour made from roots of the plant of a genus Typha, keep plant name same as NaturalResource.Cattail.DisplayName"
Good.CattailFlour.DisplayName,แป้งธูปฤาษี,"Flour made from roots of the plant of a genus Typha, keep plant name same as NaturalResource.Cattail.DisplayName"
Good.CattailFlour.PluralDisplayName,แป้งธูปฤาษี,"Flour made from roots of the plant of a genus Typha, keep plant name same as NaturalResource.Cattail.DisplayName"
Good.CattailRoot.DisplayName,รากธูปฤาษี,"Root of plant of a genus Typha, keep plant name same as NaturalResource.Cattail.DisplayName"
Good.CattailRoot.PluralDisplayName,รากธูปฤาษี,"Root of plant of a genus Typha, keep plant name same as NaturalResource.Cattail.DisplayName"
Good.Chestnut.DisplayName,เกาลัด,"Fruit of a Aesculus hippocastanum tree, also known as conkers"
Good.Chestnut.PluralDisplayName,เกาลัด,"Fruit of a Aesculus hippocastanum tree, also known as conkers"
Good.Coffee.DisplayName,กาแฟ,Brewed coffee.
Good.Coffee.PluralDisplayName,กาแฟ,Brewed coffee.
Good.CoffeeBean.DisplayName,เมล็ดกาแฟ,Coffee beans used to brew Coffee.
Good.CoffeeBean.PluralDisplayName,เมล็ดกาแฟ,Coffee beans used to brew Coffee.
Good.Corn.DisplayName,ข้าวโพด,Ordinary yellow corn plant.
Good.Corn.PluralDisplayName,ข้าวโพด,Ordinary yellow corn plant.
Good.CornRation.DisplayName,อาหารข้าวโพด,"Corn should be the same as Good.Corn.DisplayName. Ration should be consistent between Good.AlgaeRation.DisplayName, Good.CornRation.DisplayName, Good.EggplantRation.DisplayName and Building.FoodFactory.Description"
Good.CornRation.PluralDisplayName,อาหารข้าวโพด,"Corn should be the same as Good.Corn.DisplayName. Ration should be consistent between Good.AlgaeRation.DisplayName, Good.CornRation.DisplayName, Good.EggplantRation.DisplayName and Building.FoodFactory.Description"
Good.Dandelion.DisplayName,แดนดิไลออน,Healing plant
Good.Dandelion.PluralDisplayName,แดนดิไลออน,Healing plant
Good.Dirt.DisplayName,ดิน,A resource dug out from ground and used to create blocks of terrain
Good.Dirt.PluralDisplayName,ดิน,Plural form of Good.Dirt.DisplayName
Good.Eggplant.DisplayName,มะเขือม่วง,"Ordinary deep purple eggplant, also known as aubergine."
Good.Eggplant.PluralDisplayName,มะเขือม่วง,"Ordinary deep purple eggplant, also known as aubergine."
Good.EggplantRation.DisplayName,อาหารมะเขือม่วง,"Eggplant should be the same as Good.Eggplant.DisplayName. Ration should be consistent between Good.AlgaeRation.DisplayName, Good.CornRation.DisplayName, Good.EggplantRation.DisplayName and Building.FoodFactory.Description"
Good.EggplantRation.PluralDisplayName,อาหารมะเขือม่วง,"Eggplant should be the same as Good.Eggplant.DisplayName. Ration should be consistent between Good.AlgaeRation.DisplayName, Good.CornRation.DisplayName, Good.EggplantRation.DisplayName and Building.FoodFactory.Description"
Good.Explosives.DisplayName,วัตถุระเบิด,A name of a good. Not to be confused with the Dynamite building.
Good.Explosives.PluralDisplayName,วัตถุระเบิด,A name of a good. Not to be confused with the Dynamite building.
Good.Extract.DisplayName,สารสกัด,"A liquid good produced from badwater in centrifuges which is used for manufacturing advanced buildings, machines and dynamite. While raw badwater is dangerous, extract is a useful chemical."
Good.Extract.PluralDisplayName,สารสกัด,"A liquid good produced from badwater in centrifuges which is used for manufacturing advanced buildings, machines and dynamite. While raw badwater is dangerous, extract is a useful chemical."
Good.FermentedCassava.DisplayName,มันสำปะหลังหมัก,"Cassava should be the same as Good.Cassava.DisplayName, fermented should be the same as in Building.Fermenter.DisplayName or Building.Fermenter.Description"
Good.FermentedCassava.PluralDisplayName,มันสำปะหลังหมัก,"Cassava should be the same as Good.Cassava.DisplayName, fermented should be the same as in Building.Fermenter.DisplayName or Building.Fermenter.Description"
Good.FermentedMushroom.DisplayName,เห็ดหมัก,"Mushroom should be the same as Good.Mushroom.DisplayName, fermented should be the same as in Building.Fermenter.DisplayName or Building.Fermenter.Description"
Good.FermentedMushroom.PluralDisplayName,เห็ดหมัก,"Mushroom should be the same as Good.Mushroom.DisplayName, fermented should be the same as in Building.Fermenter.DisplayName or Building.Fermenter.Description"
Good.FermentedSoybean.DisplayName,ถั่วเหลืองหมัก,"Soybean should be the same as Good.Soybean.DisplayName, fermented should be the same as in Building.Fermenter.DisplayName or Building.Fermenter.Description"
Good.FermentedSoybean.PluralDisplayName,ถั่วเหลืองหมัก,"Soybean should be the same as Good.Soybean.DisplayName, fermented should be the same as in Building.Fermenter.DisplayName or Building.Fermenter.Description"
Good.Flour.DisplayName,แป้ง,A name of a good.
Good.Flour.PluralDisplayName,แป้ง,A name of a good.
Good.Gear.DisplayName,เฟือง,A name of a good.
Good.Gear.PluralDisplayName,เฟือง,A name of a good.
Good.Grease.DisplayName,จาระบี,Grease is a good used as lubricant for IronTeeth faction bot machinery to increase their performance.
Good.Grease.PluralDisplayName,จาระบี,Grease is a good used as lubricant for IronTeeth faction bot machinery to increase their performance.
Good.GrilledChestnut.DisplayName,เกาลัดย่าง,"Grilled fruit of a Aesculus hippocastanum tree, also known as conkers, keep plant name same as Good.Chestnut.DisplayName."
Good.GrilledChestnut.PluralDisplayName,เกาลัดย่าง,"Grilled fruit of a Aesculus hippocastanum tree, also known as conkers, keep plant name same as Good.Chestnut.DisplayName."
Good.GrilledPotato.DisplayName,มันฝรั่งย่าง,A name of a good.
Good.GrilledPotato.PluralDisplayName,มันฝรั่งย่าง,A name of a good.
Good.GrilledSpadderdock.DisplayName,บัวเหลืองย่าง,"Grilled plant Nuphar Lutea, keep plant name same as NaturalResource.Spadderdock.DisplayName"
Good.GrilledSpadderdock.PluralDisplayName,บัวเหลืองย่าง,"Grilled plant Nuphar Lutea, keep plant name same as NaturalResource.Spadderdock.DisplayName"
Good.Kohlrabi.DisplayName,กะหล่ำปม,"Also called German turnip or turnip cabbage, it's a big, round turnip plant."
Good.Kohlrabi.PluralDisplayName,กะหล่ำปม,"Also called German turnip or turnip cabbage, it's a big, round turnip plant."
Good.Log.DisplayName,ท่อนไม้,A name of a good.
Good.Log.PluralDisplayName,ท่อนไม้,A name of a good.
Good.MangroveFruit.DisplayName,ผลไม้ป่าชายเลน,"Fruit of the mangrove tree, mangrove should be the same as in NaturalResource.Mangrove.DisplayName"
Good.MangroveFruit.PluralDisplayName,ผลไม้ป่าชายเลน,"Fruit of the mangrove tree, mangrove should be the same as in NaturalResource.Mangrove.DisplayName"
Good.MaplePastry.DisplayName,ขนมอบเมเปิล,A baked good filled with maple syrup.
Good.MaplePastry.PluralDisplayName,ขนมอบเมเปิล,A baked good filled with maple syrup.
Good.MapleSyrup.DisplayName,น้ำเชื่อมเมเปิล,Sweet syrup created from maple sap
Good.MapleSyrup.PluralDisplayName,น้ำเชื่อมเมเปิล,Sweet syrup created from maple sap
Good.MetalBlock.DisplayName,บล็อกโลหะ,A name of a good.
Good.MetalBlock.PluralDisplayName,บล็อกโลหะ,A name of a good.
Good.Mushroom.DisplayName,เห็ด,"Mushroom that's been cultivated in the Hydroponic Garden, it's processed into an edible ration. It doesn't specifically represent any specific mushroom, just the type of plant."
Good.Mushroom.PluralDisplayName,เห็ด,"Mushroom that's been cultivated in the Hydroponic Garden, it's processed into an edible ration. It doesn't specifically represent any specific mushroom, just the type of plant."
Good.Paper.DisplayName,กระดาษ,A name of a good.
Good.Paper.PluralDisplayName,กระดาษ,A name of a good.
Good.PineResin.DisplayName,ยางสน,Also known as pine sap. Pine is the type of tree defined in NaturalResource.Pine.DisplayName.
Good.PineResin.PluralDisplayName,ยางสน,Also known as pine sap. Pine is the type of tree defined in NaturalResource.Pine.DisplayName.
Good.Plank.DisplayName,ไม้กระดาน,A name of a good.
Good.Plank.PluralDisplayName,ไม้กระดาน,A name of a good.
Good.Potato.DisplayName,มันฝรั่ง,A name of a good.
Good.Potato.PluralDisplayName,มันฝรั่ง,A name of a good.
Good.PunchCard.DisplayName,บัตรเจาะรู,"Punch cards are goods used for increasing Folktails faction bot performance. They are similar in concept to old programming cards, where code was inputted into a machine through a card with a bunch of holes punched through it."
Good.PunchCard.PluralDisplayName,บัตรเจาะรู,"Punch cards are goods used for increasing Folktails faction bot performance. They are similar in concept to old programming cards, where code was inputted into a machine through a card with a bunch of holes punched through it."
Good.ScrapMetal.DisplayName,เศษโลหะ,A name of a good.
Good.ScrapMetal.PluralDisplayName,เศษโลหะ,A name of a good.
Good.Soybean.DisplayName,ถั่วเหลือง,Soybeans can later be made into soy.
Good.Soybean.PluralDisplayName,ถั่วเหลือง,Soybeans can later be made into soy.
Good.Spadderdock.DisplayName,บัวเหลือง,A plant formally called Nuphar Lutea
Good.Spadderdock.PluralDisplayName,บัวเหลือง,A plant formally called Nuphar Lutea
Good.SunflowerSeeds.DisplayName,เมล็ดทานตะวัน,
Good.SunflowerSeeds.PluralDisplayName,เมล็ดทานตะวัน,
Good.TreatedPlank.DisplayName,ไม้กระดานเคลือบ,Plank impregnated with resin. Use the same word for plank as in Good.Plank.
Good.TreatedPlank.PluralDisplayName,ไม้กระดานเคลือบ,Plank impregnated with resin. Use the same word for plank as in Good.Plank.
Good.Water.DisplayName,น้ำ,A name of a good.
Good.Water.PluralDisplayName,น้ำ,A name of a good.
Good.Wheat.DisplayName,ข้าวสาลี,A name of a good.
Good.Wheat.PluralDisplayName,ข้าวสาลี,A name of a good.
Good.WheatFlour.DisplayName,แป้งสาลี,Flour made out of wheat. Use the same name for wheat as in Good.Wheat.
Good.WheatFlour.PluralDisplayName,แป้งสาลี,Flour made out of wheat. Use the same name for wheat as in Good.Wheat.
GoodConsuming.NeedsHaulers,<YellowHighlight>ต้องใช้นักลาก</YellowHighlight>,"Information, that this building won't be operational without haulers. Haulers are the same as in Building.HaulingPost.Description"
GoodConsuming.SupplyDescription,ใช้: {0},{0} stands for good name and amount per hour.
GoodConsuming.SupplyRemaining,เสบียงจะอยู่ได้ {0} ชั่วโมง,"{0} stands for hours. Describes a building which requires a certain goods to operate, such as water."
Goods.Amount,ปริมาณ,Header of a dropdown that allows to select a good. Please keep short.
Goods.EatableRaw,กินดิบได้,Shown on a tooltip of goods that can be eaten raw.
Goods.Nothing,ไม่มี,
Goods.StoredIn,จัดเก็บใน:,Header above a list of buildings that store selected good
GridRendering.Visibility.Hide,ซ่อนแนวเส้นก่อสร้าง,Shows construction guidelines when button is pressed.
GridRendering.Visibility.Show,แสดงแนวเส้นก่อสร้าง,Shows construction guidelines when button is pressed.
Growing.GrowsWhenMature,ให้ผลผลิตเมื่อโตเต็มที่,"Information about fruits and other resources, that grows when plant is mature and not when it is in seedling stage"
Growing.Time,จำนวนวันในการเจริญเติบโต: {0},{0} stands for a number of days. How many days left does this plant have to fully grow.
Hauling.Prioritize,นักลากให้ความสำคัญ,building is a noun in this sentence. This building will be prioritized by haulers.
Inventory.Capacity,ความจุ:,How much space there is in the storage
Inventory.Goods,สิ่งของ:,
Inventory.InStock,มีในคลัง:,Please keep short. Header above a list of goods in stock of the storage.
Inventory.IsEmpty,ไม่มีสิ่งของในคลัง,
Inventory.NothingSelected,ไม่มี,Text shown in a dropdown when no good is selected. Keep below 15 characters.
Inventory.StockpileOverlay.Hide,ซ่อนรายการในที่เก็บของ,Tooltip for button showing overlay over warehouses containing stored goods.
Inventory.StockpileOverlay.Show,แสดงรายการในที่เก็บของ,Tooltip for button showing overlay over warehouses containing stored goods.
Inventory.Undesired,ไม่ต้องการ:,Please keep short. Which goods are not desired in the storage.
Key.DownArrow,ลูกศรลง,Label of the down arrow key
Key.LeftArrow,ลูกศรซ้าย,Label of the left arrow key
Key.LeftWindows,Windows ซ้าย,Label of the left windows key
Key.RightArrow,ลูกศรขวา,Label of the right arrow key
Key.RightWindows,Windows ขวา,Label of the right windows key
Key.Space,Space,Label of the space key
Key.UpArrow,ลูกศรขึ้น,Label of the up arrow key
KeyBinding.AlternateClickableAction,การดำเนินการรองของปุ่ม,Label of the key that toggles the alternate action of some buttons
KeyBinding.AttractionsTab,เปิดแท็บสวัสดิภาพ,"Label of the key that opens the Settlement Panel and selects the Attractions tab, Well-being should be the same as Wellbeing.DisplayName"
KeyBinding.Cancel,ยกเลิก,Label of the key that cancels actions
KeyBinding.CharactersTab,เปิดแท็บประชากร,"Label of the key that opens the Settlement Panel and selects the Characters tab, Population should be the same as BatchControl.Population"
KeyBinding.Confirm,ยืนยัน,Label of the key that confirms UI prompts
KeyBinding.DecreaseBrushHeight,ลดความสูงแปรง,"Label of the key that decreases the vertical level of the brush, 'brush height' should be the same as MapEditor.Brush.Height.Label"
KeyBinding.DecreaseBrushSize,ลดขนาดแปรง,"Label of the key that decreases the size of the brush, 'brush size' should be the same as MapEditor.Brush.Size.Label"
KeyBinding.DecreaseBuildersPriority,ลดลำดับความสำคัญของช่างก่อสร้าง,Label of the key that decreases the priority of the builders job assigned to the selected object
KeyBinding.DecreaseFloodgateHeight,ลดความสูงประตูระบายน้ำ,Label of the key that decreases the height of the selected floodgate. Floodgate should be the same as Building.Floodgate.DisplayName
KeyBinding.DecreaseSpeed,ลดความเร็วเกม,Label of the key that decreases the speed of the game by one step
KeyBinding.DecreaseWorkers,ลดจำนวนแรงงานที่ต้องการ,Label of the key that decreases the desired number of workers in selected building
KeyBinding.DecreaseWorkingHours,ลดเวลาทำงาน,Label of the key that decreases settlement working hours
KeyBinding.DecreaseWorkplacePriority,ลดลำดับความสำคัญของที่ทำงาน,Label of the key that decreases the priority of the selected workplace
KeyBinding.DeleteObject,ลบวัตถุ,Label of the key that deletes the selected object
KeyBinding.DetonateDynamite,จุดระเบิด,Label of the key that detonates a dynamite
KeyBinding.DistributionTab,เปิดแท็บการกระจาย,"Label of the key that opens the Settlement Panel and selects the Distribution tab, Distribution should be the same as BatchControl.Distribution"
KeyBinding.DuplicateObject,ทำสำเนา,Key binding that duplicates the selected building
KeyBinding.DuplicateSettings,คัดลอกการตั้งค่า,Key binding that copies settings from one building to another
KeyBinding.Flip,พลิกด้าน,Label of the key that flips the selected building (makes the model mirrored)
KeyBinding.Hold,กดค้าง:,Used to describe key binding that turns something on while the key is held.
KeyBinding.HousingTab,เปิดแท็บที่อยู่อาศัย,"Label of the key that opens the Settlement Panel and selects the Housing tab, Housing should be the same as BatchControl.Housing"
KeyBinding.IncreaseBrushHeight,เพิ่มความสูงแปรง,"Label of the key that increases the vertical level of the brush, 'brush height' should be the same as MapEditor.Brush.Height.Label"
KeyBinding.IncreaseBrushSize,เพิ่มขนาดแปรง,"Label of the key that increases the size of the brush, 'brush size' should be the same as MapEditor.Brush.Size.Label"
KeyBinding.IncreaseBuildersPriority,เพิ่มลำดับความสำคัญของช่างก่อสร้าง,Label of the key that increases the priority of the builders job assigned to the selected object
KeyBinding.IncreaseFloodgateHeight,เพิ่มความสูงประตูระบายน้ำ,Label of the key that increases the height of the selected floodgate. Floodgate should be the same as Building.Floodgate.DisplayName
KeyBinding.IncreaseSpeed,เพิ่มความเร็วเกม,Label of the key that increases the speed of the game by one step
KeyBinding.IncreaseWorkers,เพิ่มจำนวนแรงงานที่ต้องการ,Label of the key that increases the desired number of workers in selected building
KeyBinding.IncreaseWorkingHours,เพิ่มเวลาทำงาน,Label of the key that increases settlement working hours
KeyBinding.IncreaseWorkplacePriority,เพิ่มลำดับความสำคัญของที่ทำงาน,Label of the key that increases the priority of the selected workplace
KeyBinding.InverseBrushDirection,กลับทิศทางแปรง,
KeyBinding.LevelVisibilityCursorTool,เครื่องมือเคอร์เซอร์แสดงระดับ,Name of layer tool keybinding
KeyBinding.LowerVisibleLayer,ลดระดับชั้นที่มองเห็น,Label of the key that decreases the max visible vertical level of buildings
KeyBinding.MechanicalTab,เปิดแท็บพลังงาน,"Label of the key that opens the Settlement Panel and selects the Mechanical tab, Power should be the same as BatchControl.Mechanical"
KeyBinding.MigrationTab,เปิดแท็บการอพยพ,"Label of the key that opens the Settlement Panel and selects the Migration tab, Migration should be the same as BatchControl.Migration"
KeyBinding.MoveCameraDown,ขยับกล้องลง,Label of the key that moves the camera down
KeyBinding.MoveCameraFast,เพิ่มความเร็วกล้อง,Label of the key that modifies the speed of camera movement and rotation
KeyBinding.MoveCameraLeft,ขยับกล้องไปทางซ้าย,Label of the key that moves the camera left
KeyBinding.MoveCameraRight,ขยับกล้องไปทางขวา,Label of the key that moves the camera right
KeyBinding.MoveCameraUp,ขยับกล้องขึ้น,Label of the key that moves the camera up
KeyBinding.NextDistrict,เลือกเขตถัดไป,Label of the key that selects the next district
KeyBinding.NextRootButton,กลุ่มเครื่องมือใหม่,Label of the key that selects the next toolbar (bottom bar) category.
KeyBinding.NextTool,เครื่องมือถัดไป,Label of the key that selects the next tool from currently selected toolbar category.
KeyBinding.OpenWellbeingPanel,เปิดแผงสวัสดิภาพ,"Label of the key that opens the Well-being box, Well-being should be the same as Wellbeing.DisplayName"
KeyBinding.PickVisibleLayer,เลือกระดับชั้นที่มองเห็น,Label of the key that picks the layer of the visible terrain currently under the cursor
KeyBinding.PreviousDistrict,เลือกเขตก่อนหน้า,Label of the key that selects the previous district
KeyBinding.PreviousRootButton,กลุ่มเครื่องมือก่อนหน้า,Label of the key that selects the previous toolbar (bottom bar) category.
KeyBinding.PreviousTool,เครื่องมือก่อนหน้า,Label of the key that selects the previous tool from currently selected toolbar category.
KeyBinding.RaiseVisibleLayer,เพิ่มระดับชั้นที่มองเห็น,Label of the key that increases the max visible vertical level of buildings
KeyBinding.RedoChanges,ทำการแก้ไขซ้ำ,Key binding for redoing changes in Map editor.
KeyBinding.ResetCamera,รีเซ็ตกล้อง,Keybinding for resetting the camera to its default angle and zoom.
KeyBinding.ResetMapEditorSimulation,รีเซ็ตการจำลอง,Label of the key that resets the water and badwater simulations
KeyBinding.RestoreCamera,โหลดตำแหน่งกล้อง,Label of the key that restores the camera to the position saved by KeyBinding.SaveCamera
KeyBinding.RotateCameraDown,หมุนกล้องลง,Label of the key that rotates the camera down
KeyBinding.RotateCameraLeft,หมุนกล้องไปทางซ้าย,Label of the key that rotates the camera left
KeyBinding.RotateCameraLeft90,หมุนกล้องไปทางซ้าย 90 องศา,Label of the key that rotates the camera left by 90 degrees
KeyBinding.RotateCameraRight,หมุนกล้องไปทางขวา,Label of the key that rotates the camera right
KeyBinding.RotateCameraRight90,หมุนกล้องไปทางขวา 90 องศา,Label of the key that rotates the camera right by 90 degrees
KeyBinding.RotateCameraUp,หมุนกล้องขึ้น,Label of the key that rotates the camera up
KeyBinding.RotateClockwise,หมุนตามเข็มนาฬิกา,Label of the key that rotates the selected object clockwise
KeyBinding.RotateCounterclockwise,หมุนทวนเข็มนาฬิกา,Label of the key that rotates the selected object counterclockwise
KeyBinding.SaveCamera,บันทึกตำแหน่งกล้อง,Label of the key that saves the current camera position
