ID,Text,Comment
AnalyticsConsent.Agree,"Evet, kabul ediyorum",
AnalyticsConsent.Disagree,"Hayır, kabul etmiyorum",
AnalyticsConsent.Header,Oynanış verisi,Header of the panel that allows the player to consent to sending user data to the developers.
AnalyticsConsent.Info,"Lütfen Timberborn'u oynama şeklinize ilişkin veri paylaşarak oyunu daha iyi hâle getirmemize yardımcı olun.

Kabul ederseniz oyun oturumlarınız sırasında otomatik olarak oynanışa dair bilgiler toplanır.

Oyun içi ayarlardan istediğiniz zaman izinleri değiştirebilir ve verilerinizi silebilirsiniz. Daha fazla bilgi için <link><u>gizlilik politikamıza</u></link> göz atın.

Teşekkür ederiz!",
Attractions.LoadRate,Popülerlik,Header above a panel showing how popular an attraction is in each hour during the day
Attractions.Visitors,Ziyaretçiler,"A header above a list of beavers visiting an attraction, such as a campfire."
Attractions.VisitorsLimit,Ziyaretçiler: {0},{0} stands for capacity. Tells players the max capacity of the attraction in a shorter way
Autosave.Failure,Otomatik kayıt başarısız,Notification on top of the window when autosave failed. It disappears after 10 seconds
Autosave.FailureDueToFullDisk,"Otomatik kayıt, yetersiz disk alanı nedeniyle başarısız",Notification on top of the window when autosave failed. It disappears after 10 seconds
Autosave.Success,Otomatik kayıt tamamlandı,"Notification on top of the window when autosave succeeded. Keep short, it disappears after 2 seconds"
BatchControl.Distribution,Dağıtım,Title of the distribution panel
BatchControl.Housing,Barınma,Tooltip of a tab allowing to manage housing buildings.
BatchControl.Mechanical,Enerji,Tooltip of a tab allowing to manage mechanical buildings. Power must be the same as used in Mechanical.PowerInput and other Mechanical. keys.
BatchControl.Migration,Göç,Title of migration panel
BatchControl.NoDistrict,Seçili bölge yok.,Shown when no district is selected on some batch control tabs
BatchControl.Population,Nüfus,Tooltip of a tab allowing to manage population.
BatchControl.ShowInfo,Yerleşimini düzenle,Button opening a window to view and manage multiple buildings and characters at once . Please keep short
BatchControl.Storage,Depolama,Tooltip of a tab allowing to manage warehouses.
BatchControl.Workplaces,İş Yerleri,Tooltip of a tab allowing to manage workplaces.
Beaver.Adult.TemplateName,Yetişkin kunduz,
Beaver.Adulthood,Yetişkinlik,Next to a progress bar that shows when a baby beaver reaches adulthood.
Beaver.Age,Yaş: {0},"{0} stands for number of days, for example 'Age: 5'."
Beaver.Child.TemplateName,Yavru kunduz,
Beaver.DeadNameSuffix,(ölü),Preceded by beaver name and age
Beaver.DiedOldAge,{0} yaşlılık sebebiyle öldü.,{0} stands for beaver name
Beaver.Employment,İstihdam,Header of a section that tells of how many and where beavers are working
Beaver.GrewUp,{0} büyüdü.,{0} stands for beaver name. A notification that a beaver achieved maturity.
Beaver.Homeless,Evsiz,Signifies that the beaver has no home
Beaver.HomelessPlural,Evsiz,Label before number of homeless beavers
Beaver.House,Yaşadığı yer: {0},{0} stands for Building.DisplayName. Tells which type of building the beaver resides in.
Beaver.Launched,{0} fırlatıldı.,{0} stands for beaver name. A notification that a beaver has been launched in a plane.
Beaver.PluralDisplayName,Kunduzlar,
Beaver.Population.Adults,Yetişkinler,Label before number of adult beavers
Beaver.Population.Children,Yavrular,Label before number of kit beavers
Beaver.Population.Contaminated,Hasta,Header of the list of beavers contaminated by badwater. Should be similar or same as Need.BadwaterContamination.DisplayName
Beaver.Population.ContaminatedAdults,Hasta yetişkinler,"Label before number of adult beavers contaminated by badwater. ""Contaminated"" should be similar or same as Need.BadwaterContamination.DisplayName. Ideally all uses of the word contaminate/contamination/contaminated should be uniform across the project."
Beaver.Population.ContaminatedChildren,Hasta yavrular,"Label before number of children beavers contaminated by badwater. ""Contaminated"" should be similar or same as Need.BadwaterContamination.DisplayName. Ideally all uses of the word contaminate/contamination/contaminated should be uniform across the project."
Beaver.Unemployed,İşsiz,"Signifies that the beaver has no job, singular"
Beaver.UnemployedPlural,İşsiz,"Used in population statistics, followed by the number of unemployed beavers"
Beaver.Workplace,Çalıştığı yer: {0},{0} stands for Building.DisplayName. Tells which type of building the beaver works in.
Bonus.CarryingCapacity,Taşıma kapasitesi,How much stuff a unit can carry
Bonus.CuttingSuccessChance,Kesme ihtimali,Cutting chance when cutting down a tree
Bonus.GrowthSpeed,Büyüme hızı,Speed at which young beavers grow up
Bonus.LifeExpectancy,Ortalama yaşam süresi,The presumed length of beavers' life.
Bonus.MovementSpeed,Hareket hızı,"Describes how fast character can move (bonus to walking, running and swimming)."
Bonus.WorkingSpeed,Çalışma hızı,Speed at which the beavers work.
Bot.BeaversPerished,"Kunduz falan deme bana hiç.
Temiz havadan tut, tatlı suya kadar her şeyleri vardı.
Şimdi hepsi mazide kaldı.","Text for a game over state, when all beavers have perished."
Bot.Created,{0} oluşturuldu!,{0} stands for bot name. Notification that shows when production of a new bot finishes.
Bot.DeadNameSuffix,(imha edildi),Preceded by bot name and age
Bot.DeathMessage,{0} bozuldu.,{0} stands for bot name. Notification that shows when a bot breaks down completely (it's destroyed)
Bot.DisplayName.Folktails,Kerestebot {0},{0} stands for a bot serial number. Name of bots from the Folktails faction. Named after the fact they are visibly made from wood.
Bot.DisplayName.IronTeeth,Demirbot {0},{0} stands for a bot serial number. Name of bots from the Iron Teeth faction. Named after the fact they are visibly made from metal.
Bot.Durability,Dayanıklılık,Label before a progress bar showing amount of durability left
Bot.PluralDisplayName,Botlar,"Bots are autonomous robots, who assist beavers in their everyday tasks. They are constructed in factories."
Bot.TemplateName,Bot,A bot is an animated anthropomorphic being which is created from inanimate matter. Timberborn bots are depicting beavers and are made of wood and metal.
Breeding.NutrientBringing,"Gıda; nakliyeciler, işsizler ve iş çıkışında işçiler tarafından getirilir.","Haulers are the same as in Building.HaulingPost.Description, unemployed as in Beaver.UnemployedPlural, workers as in Work.WorkersLabel"
Breeding.NutrientsNeeded,Gerekli gıdalar:,Followed by a list of nutrients needed to produce a new beaver in breeding facility
Breeding.Progress,Üreme ilerlemesi,Label inside a progress bar describing production progress of new beaver in breeding facility
BuilderPriorityTool.Description,"İnşaat, yıkım ve Molozlardan mal toplama eylemlerinin önceliğini belirlemek için bu aracı kullan.",Rubble should be plural version of RecoveredGoodStack.DisplayName
BuilderPriorityTool.Tip,Öncelik belirlemek için bir ögeye tıkla veya daha büyük bir alanı seçmek için düğmeyi basılı tut.,
Building.AdvancedBreedingPod.Description,"Gelişmiş bir üreme süreci kullanarak yetişkin, işe atılmaya hevesli kunduzlar dünyaya getirir.",Breeding should be the same as Building.BreedingPod.DisplayName
Building.AdvancedBreedingPod.DisplayName,Gelişmiş Üreme Kapsülü,
Building.AdvancedBreedingPod.FlavorDescription,"Bir yavru, öz dolu bir kazana düşüp onun tamamını içtikten sonra birden bire boy atınca bu fikir ortaya çıktı.","Extract must be the same as Good.Extract.DisplayName, kit is a young beaver."
Building.Agora.Description,Kunduzların kerestelerle ilgili konuları konuşabileceği büyük bir toplanma alanı.,
Building.Agora.DisplayName,Agora,
Building.Agora.FlavorDescription,"Yeşil ateşlerin yanması, Köykuyrukların toplanması için bir işarettir.",Folktails must be same as faction as Faction.Folktails.DisplayName.
Building.AncientAquiferDrill.DisplayName,Kadim Akifer Kazıcısı,
Building.AquaticFarmhouse.Description,<YellowHighlight>Sucul</YellowHighlight> ekinler ekip biçen özel çiftçileri istihdam eder.,"Aquatic is a keyword, must be the same as in NaturalResources.Aquatic."
Building.AquaticFarmhouse.DisplayName,Sucul Çiftlik Evi,A farmhouse that specializes in water plants.
Building.AquaticFarmhouse.FlavorDescription,"""Bir zamanlar balık yediğimize dair bir söylenti vardı. İğrenç!"" —Ngonel Nine","Beavers eating fish is a common misconception. Beavers are 100% herbivores. Ma' Ngonel is an almost legendary figure - a beaver grandma, known for her stern hand, cooking skills and respect among both kits and adult beavers. Her name is an inside joke, as our community constantly demands an addition of catapults, mangonels etc."
Building.Aquifer.Description,Bir yer altı su kaynağı.,
Building.Aquifer.DisplayName,Akifer,
Building.AquiferDrill.Description,Bir akiferden su çıkarır.,
Building.AquiferDrill.DisplayName,Akifer Kazıcısı,
Building.BadtideDrain.Description,Bir Bulantı Mevsimi sırasında bulantı fışkırtır.,
Building.BadtideDrain.DisplayName,Bulantı Gideri,
Building.BadwaterDischarge.Description,Bir Bulantı Kaynağı'nı mühürler. Açıp kapatabilirsin. Açık olduğunda kuraklık döneminde bile bulantı akışını devam ettirir.,"Badwater Source must be the same as Building.BadwaterSource.DisplayName, Badwater must be the same as Good.Badwater.DisplayName."
Building.BadwaterDischarge.DisplayName,Bulantı Tahliyesi,"Name of the building that can either stop flow of badwater or enforce flow with full power. It's a dome shaped, mechanical building that opens and closes like a camera shutter. Badwater must be the same as Good.Badwater.DisplayName."
Building.BadwaterDischarge.FlavorDescription,Yalnızca gerçek inşaat mühendisleri yaklaşabilir.,This is a reference to a youtuber called Real Civil Engineer.
Building.BadwaterDome.Description,Bir Bulantı Kaynağı'nı mühürler. İstediğinde açıp kapatılabilirsin.,"Badwater Source must be the same as Building.BadwaterSource.DisplayName, Badwater must be the same as Good.Badwater.DisplayName."
Building.BadwaterDome.DisplayName,Bulantı Kubbesi,Name of the building that stops flow of badwater when put on its source. It's a dome shaped mechanical building that can open and close by raising the cover up and down. Badwater must be the same as Good.Badwater.DisplayName.
Building.BadwaterDome.FlavorDescription,Bulantı yoksa dert yok.,"This is a reference to a Bob Marley song ""No woman, no cry""."
Building.BadwaterPump.Description,"Bulantıyı dışarı pompalayabilen güçlendirilmiş bir pompa. Düşük bulantı kirliliği, pompalama hızını yavaşlatır.",Badwater should be the same as Good.Badwater.DisplayName. Ideally all uses of the word contaminate/contamination/contaminated should be uniform across the project.
Building.BadwaterPump.DisplayName,Bulantı Pompası,Badwater should be the same as Good.Badwater.DisplayName.
Building.BadwaterPump.FlavorDescription,"""Keşke önlem olarak burun tıkacı da verilseydi."" —Suli",Suli is a younger beaver that likes to play tricks on their fellow beavers and isn't related to any faction in particular. Translated name shouldn't suggest a gender if possible.
Building.BadwaterRig.Description,Bir Bulantı Kaynağını mühürler. Bulantıyı doğrudan kaynağından çıkaran işçileri istihdam eder.,"Badwater Source must be the same as Building.BadwaterSource.DisplayName, Badwater must be the same as Good.Badwater.DisplayName."
Building.BadwaterRig.DisplayName,Bulantı Kulesi,Name of the building that stops flow from badwater source and generates Good.Badwater.DisplayName goods (by extracting them from source). It's a mechanical building that needs workers to operate. Badwater must be the same as Good.Badwater.DisplayName
Building.BadwaterRig.FlavorDescription,Kaynayan bulantı kaynaklarının tepesinde çalışan işçiler sürekli baskı altındadır.,Play on words with pressure referring to both water pressure and stress. If possible try to adapt the phrase to fit your language.
Building.BadwaterSeep.Description,Sınırlı basınca sahip bir bulantı kaynağı.,
Building.BadwaterSeep.DisplayName,Bulantı Sızıntısı,"A building that allows badwater to seep through, creating a natural badwater source."
Building.BadwaterSource.DisplayName,Bulantı Kaynağı,A crack or spring in the ground spuming badwater. Badwater should be the same as Good.Badwater.DisplayName.
Building.BadwaterSource.FlavorDescription,"""Biz neden bu insancıkların arkasını toplamak zorundayız ki? Doğru ya, hepsi öldü çünkü."" —Pina",
Building.Bakery.Description,Farklı unlardan ekmek ve hamur işi üretir.,Pastry being a baked good.
Building.Bakery.DisplayName,Fırın,Building that bakes bread
Building.Bakery.FlavorDescription,"“Talaşlı sıcak çörek gibisi yok."" —Ngonel Nine","Ma' Ngonel is an almost legendary figure - a beaver grandma, known for her stern hand, cooking skills and respect among both kits and adult beavers. Her name is an inside joke, as our community constantly demands an addition of catapults, mangonels etc."
Building.Barrack.Description,"Pratik, paylaşımlı konutlar.",
Building.Barrack.DisplayName,Baraka,Barracks are cramped homes for beavers. Not related to soldiers.
Building.Barrack.FlavorDescription,"“İki Köykuyruk günün birinde bir barakaya gitmiş."" —Demir Diş fıkrası","Reference to 'walk into a bar' jokes; only Iron Teeth use Barracks, as Folktails prefer different lodges and are less work-focused than Iron Teeth"
Building.BeaverBust.Description,Önemli görünen bir kunduzun büstü.,
Building.BeaverBust.DisplayName,Kunduz Büstü,
Building.BeaverBust.FlavorDescription,"Yaramaz yavrular, İhtiyar Kazko'nun yüzüne çeşitli detaylar eklemeyi severler.","Ol' Kazko is a legendary forefather of modern beavers, famous inventor, pioneer of rapid industrialization. Kits are young beavers."
Building.BeaverStatue.Description.Folktails,Tombul bir kunduzun heykeli.,
Building.BeaverStatue.Description.IronTeeth,Çalışkan bir kunduzun heykeli.,
Building.BeaverStatue.DisplayName,Kunduz Heykeli,Statue of a beaver
Building.BeaverStatue.FlavorDescription.Folktails,"Bereketli yıllarda gururlandırır, kötü yıllarda ise acıktırır.",The statue shows a beaver with a full belly so it can make one hungry when looking at it.
Building.BeaverStatue.FlavorDescription.IronTeeth,"Hazırlanan orijinal oraklı tasarım, fazla Köykuyruk tarzı durduğu için değiştirdiler.",This metal statue depicts a beaver worker with a raised hammer. Hammer and sickle is an emblem of Soviet Russia. Folktails must be same as faction name (Faction.Folktails.DisplayName).
Building.Beehive.Description,Yakınlardaki ekinlerin büyümesini hızlandırır.,
Building.Beehive.DisplayName,Kovan,
Building.Beehive.FlavorDescription,"""Zamanla vızıltıya alışıyorsun."" —Ngonel Nine","Ma' Ngonel is an almost legendary figure - a beaver grandma, known for her stern hand, cooking skills and respect among both kits and adult beavers. Her name is an inside joke, as our community constantly demands an addition of catapults, mangonels etc."
Building.Bell.Description,İş günlerinin başında ve sonunda çalar.,This is a large metal bell that rings twice a day.
Building.Bell.DisplayName,Çan,A large metal bell
Building.Bell.FlavorDescription,"""Sabah çanını dört gözle beklemelisin."" —İhtiyar Kazko","Ol' Kazko is a legendary forefather of modern beavers, famous inventor, pioneer of rapid industrialization."
Building.Bench.DisplayName,Bank,
Building.Bench.FlavorDescription,Bazı serseriler arada bir kamu mallarını kemirir.,
Building.Blockage.Description,Suyu durduran doğal bir engel. Yıkılabilir.,Demolished meaning removed by a worker.
Building.Blockage.DisplayName,Tıkanıklık,"Not a dam since that's another building in game but if not possible it could be called a Natural Dam. Visually, it's a block made out of twigs and loose stones."
Building.Blockage.FlavorDescription,Bir zamanlar dal ve çamur yığınlarının baraj sayıldığına inanmak zor.,
Building.BotAssembler.Description,Gündelik işleri yerine getirmeleri için otomatik botlar üretir.,Bots should be the same as Bot.PluralDisplayName
Building.BotAssembler.DisplayName,Bot Birleştirici,A factory for assembling bots. Bot should be the same as Bot.TemplateName
Building.BotAssembler.FlavorDescription,"Her şey ""Bugün çalışmasam ne olur?"" düşüncesiyle başladı. —Pina",
Building.BotPartFactory.Description,Bot parçaları üretir.,Bot should be the same as Bot.TemplateName
Building.BotPartFactory.DisplayName,Bot Parçası Fabrikası,"A factory for creating bot parts, that are later assembled into full bots. Bot should be the same as Bot.TemplateName."
Building.BotPartFactory.FlavorDescription,"""Bitti! Bir saniye, bu büyük vida da nereden çıktı?"" —Pina",
Building.Brazier.Description,Dekoratif bir muhafaza içinde güvenle yanan harlı bir ateş.,
Building.Brazier.DisplayName,Ocak,
Building.Brazier.FlavorDescription,"""Vay be, yakıyorsun ortalığı!"" —Suli",Play on words with lit meaning both lit up and cool. If possible try to adapt the phrase to fit your language. Suli is a younger beaver that likes to play tricks on their fellow beavers and isn't related to any faction in particular. Translated name shouldn't suggest a gender if possible.
Building.BrazierOfBonding.DisplayName,Dayanışma Ocağı,A large brazier surrounded by statues of a beaver family
Building.BrazierOfBonding.FlavorDescription,"""Bizim için olmasa da gelecek nesiller için."" —Ngonel Nine","Ma' Ngonel is an almost legendary figure - a beaver grandma, known for her stern hand, cooking skills and respect among both kits and adult beavers. Her name is an inside joke, as our community constantly demands an addition of catapults, mangonels etc."
Building.BreedingPod.Description,Demir Dişlerin tercih ettikleri tek üreme yöntemi.,Iron Teeth must be the same as the faction name (Faction.IronTeeth.DisplayName).
Building.BreedingPod.DisplayName,Üreme Kapsülü,
Building.BreedingPod.FlavorDescription,"""Yavrular bizim geleceğimiz. Gelecek aya kadar on iki yavru daha lazım."" —İhtiyar Kazko","Ol' Kazko is a legendary forefather of modern beavers, famous inventor, pioneer of rapid industrialization."
Building.BuildersHut.Description,Fazladan inşaatçı istihdam eder.,
Building.BuildersHut.DisplayName,İnşaatçı Locası,
Building.BuildersHut.FlavorDescription,Kunduzroma bir günde kurulmadı. Efsanelere göre sadece altı saat sürmüş.,Beaverome is a mythical beaver city built by beavers of many different factions who banded together to work on timbertech for the greater good of all beavers.
Building.BulletinPole.Description,Halka yapılan duyurular için dekoratif bir direk.,
Building.BulletinPole.DisplayName,Bülten Direği,
Building.BulletinPole.FlavorDescription,İş yerinde yaralandınız mı? Tazminat hakkınız olabilir! Suli ile iletişime geçin.,Reference to common compensation scam text. Suli is a younger beaver that likes to play tricks on their fellow beavers and isn't related to any faction in particular. Translated name shouldn't suggest a gender if possible.
Building.Campfire.Description,Kunduzların akşam rahatlayıp sosyalleştikleri bir yer.,
Building.Campfire.DisplayName,Kamp Ateşi,
Building.Campfire.FlavorDescription,Bazen ateş ve odun iyi bir ikilidir.,
Building.Carousel.Description,"Her yaştan kunduza uygun, ahşaptan bir atlıkarınca.",
Building.Carousel.DisplayName,Atlıkarınca,Alternative name: Merry-Go-Round
Building.Carousel.FlavorDescription,"""Nereye gittiğini sanıyorsun yavrucuk? Bu dallar kendi kendilerini soymayacak."" —Ngonel Nine","Ma' Ngonel is an almost legendary figure - a beaver grandma, known for her stern hand, cooking skills and respect among both kits and adult beavers. Her name is an inside joke, as our community constantly demands an addition of catapults, mangonels etc."
Building.Centrifuge.Description,"Tehlikeli bulantıyı, kullanılabilir öze dönüştüren bir ağır iş makinesi.",Badwater should be the same as Good.Badwater.DisplayName. Extract should be the same as Good.Extract.DisplayName.
Building.Centrifuge.DisplayName,Santrifüj,
Building.Centrifuge.FlavorDescription,"Bu fikir, kontrolden çıkıp çok hızlı dönmeye başlayan bir Köykuyruk atlıkarıncasından çıktı.","Folktails must be the same as Faction.Folktails.DisplayName, carousel should be the same as Building.Carousel.DisplayName."
Building.ChargingStation.Description,Botların şarjlarını doldurmak için geldikleri yer.,Bots should be the same as Bot.PluralDisplayName
Building.ChargingStation.DisplayName,Şarj İstasyonu,A mechanically powered building where bots come to recharge
Building.ChargingStation.FlavorDescription,Demirbot dışındaki cihazlarla kullanılamaz.,"Referring the annoying ""a different connector for each device"" trend in IT. Ironbot must be the same as Bot.DisplayName.IronTeeth"
Building.Clock.Description,"Dedelerin bile okuyabileceği büyüklükte, dekoratif bir saat.",
Building.Clock.DisplayName,Saat,
Building.Clock.FlavorDescription,Kunduzların geçmişte su saati kullandıklarına inanmak çok zor.,Clepsydra is an ancient water clock.
Building.CoffeeBrewery.Description,Kahve demler.,Coffee should be the same as in Good.Coffee.DisplayName.
Building.CoffeeBrewery.DisplayName,Kahveci,A building that brews coffee.
Building.CoffeeBrewery.FlavorDescription,Tüketim sınırı olmasa Demiş Dişler hep uykusuz gezerdi.,
Building.CompactWaterWheel.Description,Su akışını enerjiye dönüştüren küçük bir jeneratör.,
Building.CompactWaterWheel.DisplayName,Küçük Su Değirmeni,A water wheel that's smaller than other versions.
Building.CompactWaterWheel.FlavorDescription,Taşıma su ile değirmen dönmezmiş.,A play on 'can't reinvent the wheel'
Building.ContaminationBarrier.Description,Toprak kirliliğinin yer altına yayılmasını engeller.,Ideally all uses of the word contaminate/contamination/contaminated should be uniform across the project.
Building.ContaminationBarrier.DisplayName,Kirlilik Bariyeri,Name of the building that stops spreading soil contamination that's placed on the ground and is presented as square shape with objects sticking out. Ideally all uses of the word contaminate/contamination/contaminated should be uniform across the project. Barrier should be the same between Building.IrrigationBarrier.DisplayName and Building.ContaminationBarrier.DisplayName.
Building.ContaminationBarrier.FlavorDescription,"“Bariyer giren eve bulantı mevsimi girmez!"" —slogan posteri","Reference to the ""An apple a day, keeps the doctor away"" proverb. If possible try to adapt the phrase to fit your language."
Building.ContemplationSpot.Description,Kunduzların doğayı seyredebilecekleri küçük bir yer.,
Building.ContemplationSpot.DisplayName,Seyir Noktası,
Building.ContemplationSpot.FlavorDescription,Kunduzlar burada biraz kafa dinleyip Doğa Ana'nın sürprizleri üzerine düşünür.,
Building.ControlTower.Description,Çevredeki botlara performanslarını iyileştiren sinyaller gönderen uzun bir yapı.,Bots should be the same as Bot.PluralDisplayName
Building.ControlTower.DisplayName,Kontrol Kulesi,A building that emits a signal to nearby bots
Building.ControlTower.FlavorDescription,"Bir bot, kunduz varlıklar tarafından verilen emirlere itaat etmek zorundadır. Bu durum, yalnızca kunduzlar artık var olmadığında geçersizdir.","A loose adaptation of Asimov's second law of robotics (and a hint at the ""sentient AI"" scenario). Bot must be the same as Bot.TemplateName."
Building.Dam.Description,Suyu engeller ancak bir kısmının tepedeki savaktan geçmesine izin verir.,Spillway is a hole near the top that allows for the water to pass.
Building.Dam.DisplayName,Baraj,
Building.Dam.FlavorDescription,Medeniyetlerin temellerinin su altında atıldığını herkes bilir.,
Building.DanceHall.Description,Kunduzların kuyruklarını uzatıp dinlenebilecekleri bir salon.,
Building.DanceHall.DisplayName,Dans Salonu,
Building.DanceHall.FlavorDescription,"""Hadisene, kenarda Demir Diş gibi dikilmeye mi geldin?"" —Suli",Iron Teeth must be the same as Faction.IronTeeth.DisplayName. Suli is a younger beaver that likes to play tricks on their fellow beavers and isn't related to any faction in particular. Translated name shouldn't suggest a gender if possible.
Building.DecontaminationPod.Description,Kunduzların maruz kaldıkları bulantıdan arınabilecekleri bir banyo.,Badwater should be the same as Good.Badwater.DisplayName.
Building.DecontaminationPod.DisplayName,Arınma Kapsülü,Ideally the name of the building should refer to the contamination effect on the beaver (Need.BadwaterContamination).
Building.DecontaminationPod.FlavorDescription,"""Hayır Suli, özü içemezsin. Yavruyken kazanın içine düşmüştün!"" —Ngonel Nine","Reference to Obelix from Asterix and Obelix falling into a cauldron. Suli is a younger beaver that likes to play tricks on their fellow beavers and isn't related to any faction in particular. Translated name shouldn't suggest a gender if possible. Ma' Ngonel is an almost legendary figure - a beaver grandma, known for her stern hand, cooking skills and respect among both kits and adult beavers. Her name is an inside joke, as our community constantly demands an addition of catapults, mangonels etc."
Building.DeepBadwaterPump.DisplayName,Derin Bulantı Pompası,"Badwater Pump Must be the same as Building.BadwaterPump.DisplayName, Deep should be the same as in Building.DeepWaterPump.DisplayName"
