ID,Text,Comment
Building.MetalPlatform5x5.Description,"Sağlam bir sütun tarafından desteklenen büyük, metal bir platform.",
Building.MetalPlatform5x5.DisplayName,5x5 Metal Platform,Numbers at the end denote size X by Y.
Building.Mine.Description,Yer Altı Harabelerinden hurda metal çıkaran madencileri istihdam eder.,"Underground Ruins is a building, same as Building.Underground Ruins.DisplayName"
Building.Mine.DisplayName,Maden,An extracting facility which can be placed on underground ruins.
Building.Mine.FlavorDescription,Kunduz literatüründe fazla açgözlü veya fazla derin kazmak diye bir şey yoktur.,"The mine provides an endless supply of scrap metal. Reference to 'they delved too greedily and too deep, and disturbed that from which they fled, Durin's Bane' from LOTR"
Building.MiniLodge.Description,Tek bir kunduz için küçük bir barınak.,
Building.MiniLodge.DisplayName,Mini Barınak,A small lodge for only one beaver
Building.MiniLodge.FlavorDescription,Bir tane de iyidir.,Referencing 'Two Beavers Are Better Than One' meme-song from 'How I Met Your Mother' TV show.
Building.Motivatorium.Description,Temel Demir Diş değerlerini öğreten mekanik bir tiyatro.,Iron Teeth must be the same as Faction.IronTeeth.DisplayName.
Building.Motivatorium.DisplayName,Teşvikhane,
Building.Motivatorium.FlavorDescription,"""Her gün her gece mücadele ediyoruz. Harika bir şey."" —İhtiyar Kazko","Ol' Kazko is a legendary forefather of modern beavers, famous inventor, pioneer of rapid industrialization."
Building.MudBath.Description,Mekanik olarak baloncuklarla doldurulmuş bir çamur banyosu.,
Building.MudBath.DisplayName,Çamur Banyosu,"A mud bath infused with bubbles, basically a jacuzzi but that word is too human."
Building.MudBath.FlavorDescription,Bu baloncuklar nereden geliyor?,Fart joke but it's easy to see it as bubbles all appear in the middle of the bath where the visitors' tails are directed.
Building.MudPit.Description,Rahatlatıcı bir çamur kaplıcası.,This building allows beavers to relax in an area similar to a spa.
Building.MudPit.DisplayName,Çamur Kaplıcası,"This building is a pit filled with mud, not for storage but entertainment."
Building.MudPit.FlavorDescription,Yavrular ilk minik barajlarını burada inşa ediyor.,
Building.NaturalDam.Description,Suyu engelleyen ancak bir kısmının tepedeki savaktan geçmesine izin veren doğal bir bariyer. Yıkılabilir.,
Building.NaturalDam.DisplayName,Doğal Baraj,
Building.NaturalOverhang.Description,Köprü ve temel görevi gören çıkıntılı bir kaya platformu. Su geçirmez.,
Building.NaturalOverhang.FlavorDescription,"""Atlamadan önce aşağıda su var mı yok mu bir bak!"" —Suli",
Building.NaturalOverhang2x1.DisplayName,2x1 Doğal Saçak,This structure is a solid rock overhang. Numbers at the end denote size X by Y.
Building.NaturalOverhang3x1.DisplayName,3x1 Doğal Saçak,This structure is a solid rock overhang. Numbers at the end denote size X by Y.
Building.NaturalOverhang4x1.DisplayName,4x1 Doğal Saçak,This structure is a solid rock overhang. Numbers at the end denote size X by Y.
Building.Numbercruncher.Description,Kunduzların işletmesine gerek kalmadan hesaplamalar yapan karmaşık bir makine.,This machine is a primitive computer.
Building.Numbercruncher.DisplayName,Sayısayar,A machine that's a primitive computer. It generates science points by performing research.
Building.Numbercruncher.FlavorDescription,Modası geçmiş olan Rakam Makinesi'ne kıyasla çok daha üstün.,"Suggests that beavers - just like hoomans - create new generations of ""computers"" and retire old ones."
Building.Observatory.Description,"Kunduzlar, yıldızları keşfederek içinde yaşadıkları dünya hakkında daha fazla bilgi ediniyorlar.",A building where beavers look into the space using telescopes
Building.Observatory.DisplayName,Gözlemevi,A building where beavers look into the space using telescopes
Building.Observatory.FlavorDescription,Kamp ateşinin başında yıldızları izlemek bu binaya ilham oldu.,
Building.OilPress.Description,Uygun bitkilerden yağ çıkarır.,Oil should be the same as in Building.OilPress.DisplayName
Building.OilPress.DisplayName,Yağ Sıkacağı,A building that's a giant press that squeezes out oil.
Building.OilPress.FlavorDescription,"Meraklı yavrular bunu kullanarak, kurabiyeden çam kozalağına her şeyi ezmeye çalışırlar.","The process of squishing things with hydraulic press filmed in slo-mo is oddly fascinating, and makes for popular YT videos."
Building.Overhang.Description,Diğer yapılar için köprü veya temel görevi görebilen çıkıntılı bir platform.,
Building.Overhang.FlavorDescription,"""Görünüşe bakılırsa bulutlara çıkan bir merdiven inşa ediyoruz. Acaba..."" —Pina",
Building.Overhang2x1.DisplayName,2x1 Saçak,An artificial overhang made out of wood and metal that allows new buildings to be put on top of it. Numbers at the end denote size X by Y.
Building.Overhang3x1.DisplayName,3x1 Saçak,An artificial overhang made out of wood and metal that allows new buildings to be put on top of it. Numbers at the end denote size X by Y.
Building.Overhang4x1.DisplayName,4x1 Saçak,An artificial overhang made out of wood and metal that allows new buildings to be put on top of it. Numbers at the end denote size X by Y.
Building.Overhang5x1.DisplayName,5x1 Saçak,An artificial overhang made out of wood and metal that allows new buildings to be put on top of it. Numbers at the end denote size X by Y.
Building.Overhang6x1.DisplayName,6x1 Saçak,An artificial overhang made out of wood and metal that allows new buildings to be put on top of it. Numbers at the end denote size X by Y.
Building.PaperMill.Description,Makineli bir kâğıt fabrikası.,Paper is a name of a good.
Building.PaperMill.DisplayName,Kâğıt Fabrikası,
Building.PaperMill.FlavorDescription,"Başta çöpçüler için kurutulmuş bir atıştırmalık olarak ortaya çıkan bu ürün, kısa sürede birçok başka kullanım alanı buldu.",
Building.Path.Description,"Yapılar, yollar ile bağlanmalıdır.",
Building.Path.DisplayName,Yol,
Building.Path.FlavorDescription,"""Ah bu yollar, barınağıma götürür beni."" —Meşhur bir kunduz şarkısı","Adapted from ""Take Me Home, Country Roads"" by John Denver"
Building.PlankFence.Description,Tahtadan yapılmış dekoratif bir çit.,
Building.PlankFence.DisplayName,Tahta Çit,
Building.Platform.Description,"Köprü veya diğer yapılar için bir temel görevi görebilen, yerden yüksek bir platform.",
Building.Platform.DisplayName,Platform,
Building.Platform.FlavorDescription,"Kunduz platformlarının etkileyici yük taşıma kapasiteleri, onları mühendislik başyapıtları hâline getirir.",
Building.PoleBanner.Description,Özelleştirilebilir uzun bir sancak.,
Building.PoleBanner.DisplayName,Direk sancağı,"Tall, hanging banner on a pole."
Building.PowerShaft.Description,Enerji aktarır.,"Power being mechanical/kinetic, not electricity. Alternative name: axle."
Building.PowerShaft.DisplayName,Enerji Mili,"Power being mechanical/kinetic, not electricity. Alternative name: axle."
Building.PowerShaft.FlavorDescription,"Harika icat, daha da harika bir hâl aldı.",Flavor text for the Power Shaft building
Building.PowerWheel.Description,Kunduzlar tarafından çalıştırılan bir yedek enerji kaynağı.,
Building.PowerWheel.DisplayName,Enerji Çarkı,Meaning a wheel that produces power
Building.PowerWheel.FlavorDescription,"Kunduzlar, daha az gelişmiş kemirgenlerden bazı yöntemleri örnek alabileceklerini fark ettiler.",This building looks like a hamster wheel.
Building.PrintingPress.Description,Kâğıt bazlı malları işler.,Paper should be the same as Good.Paper.DisplayName
Building.PrintingPress.DisplayName,Matbaa,
Building.PrintingPress.FlavorDescription,"Kunduzlar genelde bir sayfayı okuduktan hemen sonra yerler, bu yüzden kaliteli kitaplar her zaman revaçtadır.",
Building.Refinery.Description,Botlar için çeşitli yakıt türleri üretir.,Bots should be the same as Bot.PluralDisplayName.
Building.Refinery.DisplayName,Rafineri,A building where old food is processed to make biofuel
Building.Refinery.FlavorDescription,"Tasarruf et, rafine et, geri dönüştür.","Adapted ""Reduce, reuse, recycle"" tagline."
Building.Relic.Description,Bir Bilim patlaması için yıkılabilecek kadim teknoloji.,
Building.Relic.DisplayName,Yadigâr,Remains of a human structure/device that can be demolished to obtain a certain amount of the Science resource
Building.ReservePile.DisplayName,Yedek Yığın,
Building.ReserveTank.DisplayName,Yedek Tank,
Building.ReserveWarehouse.DisplayName,Yedek Depo,
Building.Roof.FlavorDescription,"Süslü bir çatı, genelde komşular arasında tatlı bir rekabetin ortaya çıkmasına neden olması için yeterlidir.",
Building.Roof1x1.DisplayName,1x1 Çatı,Numbers at the end denote size X by Y
Building.Roof1x2.DisplayName,1x2 Çatı,Numbers at the end denote size X by Y
Building.Roof2x2.DisplayName,2x2 Çatı,Numbers at the end denote size X by Y
Building.Roof2x3.DisplayName,2x3 Çatı,Numbers at the end denote size X by Y
Building.Roof3x2.DisplayName,3x2 Çatı,Numbers at the end denote size X by Y
Building.RooftopTerrace.Description,Kunduzların sosyalleşebileceği ve manzaranın keyfini çıkarabileceği yüksek bir teras.,
Building.RooftopTerrace.DisplayName,Çatı Terası,
Building.RooftopTerrace.FlavorDescription,Gece sohbeti için harika bir yer ve muhteşem bir manzara!,
Building.Rowhouse.Description,"Az yer kaplayan, pratik paylaşımlı konutlar.",
Building.Rowhouse.DisplayName,Sıra Ev,"A rowhouse is a narrow and tall house that is connected to other homes on both sides, often built in a row."
Building.Rowhouse.FlavorDescription,Sıralı evler müstakilden iyidir.,
Building.Ruins.Description,Sınırlı bir hurda metal kaynağı.,Metal is a name of a good.
Building.Ruins.DisplayName,Harabeler,
Building.Ruins.FlavorDescription,"Dört bir yana dağılmış eski insan harabeleri, kunduzlara hayal bile edemeyecekleri kadar değerli bir şey sağlıyordu. Bu da odundan daha üstün bir maldı.",
Building.Scarecrow.Description,"Bir zamanlar kuşları korkutması amaçlanan bir tarla süsü, artık genci yaşlısı herkese neşe veriyor.",
Building.Scarecrow.DisplayName,Korkuluk,
Building.Scarecrow.FlavorDescription,Kendi tarlasının reisi.,
Building.ScavengerFlag.Description,"Çöpçüler, harabelerden hurda metal toplar.",Metal is a name of a good;Ruins are a building
Building.ScavengerFlag.DisplayName,Çöpçü Bayrağı,
Building.ScavengerFlag.FlavorDescription,"Geleneksel olarak ahşaptan yapılan yerleşimlere metal getiren çöpçüler, kiminin saygısını kazanırken kiminin de horgörüsüne maruz kalıyor.",
Building.Scratcher.Description,O erişmesi zor kaşıntıları kaşıyan bir makine.,
Building.Scratcher.DisplayName,Kaşıyıcı,A rotating brush which beavers use to scratch their fur. For reference google videos of cow scratchers.
Building.Scratcher.FlavorDescription,Demir Dişler dinlenirken bile çalışmak için kaşınırlar.,Itching meaning having an itch as well as an idiom for wanting to do something very much. If possible try to adapt the phrase to fit your language. Iron Teeth must be the same as Faction.IronTeeth.DisplayName.
Building.Shower.Description,Kürkü ıslatmaya yarayan ferahlatıcı nehir suyu.,
Building.Shower.DisplayName,Duş,A simple shower for beavers.
Building.Shower.FlavorDescription,Çorak araziyi fethetmeyi daha kolay hâle getirir.,
Building.Shrub.DisplayName,Ağaççık,Must be different than 'Bush' which is a plant in the game
Building.Shrub.FlavorDescription,"Pratiklik adına, dekorasyonlar hem güzel hem de lezzetli olmalı.",
Building.Slope.DisplayName,Eğim,
Building.Slope.FlavorDescription,Bunu buraya kim koyduysa kunduzlar ona minnettar.,
Building.Sluice.AboveContaminationToggle,Şu kirlilik seviyesinin üstünde kapat: {0},"Label of a toggle that enables automation based on contamination level, {0} stands for currently set level, ie 5%"
Building.Sluice.BelowContaminationToggle,Şu kirlilik seviyesinin altında kapat: {0},"Label of a toggle that enables automation based on contamination level, {0} stands for currently set level, ie 5%"
Building.Sluice.Contamination,Kirlilik: {0},"Level of the water contamination, {0} stands for contamination level in percent. Ideally all uses of the word contaminate/contamination/contaminated should be uniform across the project."
Building.Sluice.Description,Tek yönlü ve otomatik bir su tahliyesi.,
Building.Sluice.DisplayName,Savak Kapağı,Also known as a sluice gate. Different than Building.Floodgate.DisplayName.
Building.Sluice.DownstreamDepth,Aşağı akış derinliği {0},{0} stands for chosen downstream depth maintained by the building.
Building.Sluice.FlavorDescription,"""Suli, bulantının sifonunu çekmeyi yine mi unuttun?"" —Ngonel Nine",Badwater has to be consistent with Good.Badwater.DisplayName
Building.Sluice.MaximumDepthToggle,Şu aşağı akış derinliğinin üstünde kapat: {0},Label of a toggle that enables automation based on the maximum downstream depth of water
Building.Sluice.Mode.Auto,Otomatik,Label of the toggle that sets the sluice to work in automatic mode
Building.Sluice.Mode.AutoClosed,Otomatik: Kapalı,Label for sluice working in automatic mode and is closed
Building.Sluice.Mode.AutoOpen,Otomatik: Açık,Label for sluice working in automatic mode and is opened
Building.Sluice.Mode.Closed,Kapalı,Label of the toggle that sets the sluice to be always closed
Building.Sluice.Mode.Open,Açık,Label of the toggle that sets the sluice to be always open
Building.Sluice.Synchronize,Bitişiğindeki savak kapakları ile senkronize et,
Building.SmallIndustrialPile.DisplayName,Küçük Endüstriyel Yığın,
Building.SmallIndustrialPile.FlavorDescription,"""Tepesine bir çatı yapıştırıp adına endüstriyel demişler. Şaşırtmadı."" —Pina",
Building.SmallPile.Description,İri malları depolar.,
Building.SmallPile.DisplayName,Küçük Yığın,
Building.SmallPile.FlavorDescription,Kendine saygısı olan kimse inşaat materyallerini yere dökmez.,
Building.SmallTank.Description,Sıvı depolar.,
Building.SmallTank.DisplayName,Küçük Tank,
Building.SmallTank.FlavorDescription,"Suyun her damlasını kullanmayı öğrenmek, kunduzların bu zorlu çevreye uyum sağlamalarına yardımcı oldu.",
Building.SmallWarehouse.Description,Mal depolar.,
Building.SmallWarehouse.DisplayName,Küçük Depo,
Building.SmallWarehouse.FlavorDescription,"""Mutfak dolabıma dinamit koymuyorum canım, sağ ol."" —Ngonel Nine",
Building.Smelter.Description,Hurda metalleri eriterek metal bloklara dönüştürür.,Scrap metal should be the same as Good.ScrapMetal.DisplayName and metal blocks should be the same as Good.MetalBlock.DisplayName
Building.Smelter.DisplayName,Kalhane,A facility that uses very high temperature to produce metal blocks from iron ore.
Building.Smelter.FlavorDescription,"Yeni kunduz dünyası, ter ve yanık post kokusu üzerine kuruluyor.",
Building.SpiralStairs.DisplayName,Spiral Merdiven,Name of a building that allows beavers to climb up and down in a spiral manner.
Building.SquareBanner.Description,Özelleştirilebilir kare bir sancak.,
Building.SquareBanner.DisplayName,Kare Sancak,"Short, standing banner in a square bracket."
Building.Stairs.DisplayName,Merdiven,
Building.Stairs.FlavorDescription,Merdivenin icadıyla birlikte kunduzlar bir üst seviyeye yükseldi.,
Building.StartingLocation.DisplayName,Başlangıç Konumu,
Building.SteamEngine.Description,Enerji üretmek için yakıt kullanır.,
Building.SteamEngine.DisplayName,Buhar Motoru,
Building.SteamEngine.FlavorDescription,Bu icat ne kadar harika olsa da Demir Dişler dışındaki tüm kunduz uluslarının eline batan bir kıymık gibiydi.,"Iron Teeth is one of the playable factions, with the Engine being one of their unique buildings."
Building.StreamGauge.Contamination,Kirlilik: {0},"Level of the water contamination, {0} stands for contamination level in percent. Ideally all uses of the word contaminate/contamination/contaminated should be uniform across the project."
Building.StreamGauge.Current,Akıntı: {0} m³s,"Intensity of the water current, {0} stands for current speed in cubic metre per second"
Building.StreamGauge.Depth,Derinlik: {0},"Level of the water depth, {0} stands for this value in meters"
Building.StreamGauge.Description,"Su derinliğini, akışını ve bulantı kirliliğini ölçer.",Badwater should be the same as Good.Badwater.DisplayName.
Building.StreamGauge.DisplayName,Akış Ölçer,
Building.StreamGauge.FlavorDescription,Kunduzların işlerinde bir dalgalanma vardır. Sele kapılıp gidildiğinde iyi şans getirir.,Adapted quote from Shakespeare's 'Julius Cesar'
Building.StreamGauge.GreatestDepth,En derin nokta: {0},"Level of the greatest noted water depth, {0} stands for this value in meters"
Building.StreamGauge.Reset,Sıfırla,
Building.SuspensionBridge.Description,Kunduzların boşlukların üzerinden geçmelerini sağlar.,
Building.SuspensionBridge.FlavorDescription,Göründüğünden daha sağlam.,
Building.SuspensionBridge1x1.DisplayName,1x1 Asma Köprü,Numbers at the end denote size X by Y
Building.SuspensionBridge2x1.DisplayName,2x1 Asma Köprü,Numbers at the end denote size X by Y
Building.SuspensionBridge3x1.DisplayName,3x1 Asma Köprü,Numbers at the end denote size X by Y
Building.SuspensionBridge4x1.DisplayName,4x1 Asma Köprü,Numbers at the end denote size X by Y
Building.SuspensionBridge5x1.DisplayName,5x1 Asma Köprü,Numbers at the end denote size X by Y
Building.SuspensionBridge6x1.DisplayName,6x1 Asma Köprü,Numbers at the end denote size X by Y
Building.SwimmingPoll.FlavorDescription,"""Çok eğlenceli olduğuna eminim ama kuyruklamanı geliştirmeliyiz!"" —Pina","Backstroke is a swimming style, but beavers also have tails. Pina is a younger beaver figure that's exploring the world and isn't related to any faction in particular. Pina as a name relates to the pine tree, the translated name shouldn't suggest a gender if possible."
Building.SwimmingPool.Description,Müdahale olmadan su altında tam vücut egzersizi sağlamak için kordonla ayrılmış kulvarlar.,
Building.SwimmingPool.DisplayName,Yüzme Havuzu,
Building.TappersShack.Description,Ağaçlardan öz ve şurup toplayan sıvı ustalarını istihdam eder.,
Building.TappersShack.DisplayName,Sıvı Ustası Kulübesi,"A shack where workers tap trees to gather sap and syrups, similar to sugar shacks in Canada."
Building.TappersShack.FlavorDescription,"Yavrular, hem suyun hem reçinenin her damlasının önemli olduğunu öğrenerek büyürler.",
Building.TeethGrindstone.Description,Kırık dişleri keskinleştirir.,Chipped teeth refers to Need.ChippedTeeth.CriticalDescription
Building.TeethGrindstone.DisplayName,Diş Bileme Taşı,A grindstone contraption for sharpening beaver teeth
Building.TeethGrindstone.FlavorDescription,"Canını dişine tak, işimiz çok.","This building is used by beavers to clear the ""chipped teeth"" status. Chipped teeth refers to Need.ChippedTeeth.DisplayName."
Building.TerrainBlock.Description,Yapay bir arazi bloğu. İnşaat sıralaması üzerindeki okları takip eder.,Block of terrain refers to Building.TerrainBlock.DisplayName.
Building.TerrainBlock.DisplayName,Arazi Bloğu,A 1x1x1 chunk of terrain
Building.Thorns.Description,Sulamayı ve kirliliği engelleyen geçilemez bir engel. Yıkması zordur ve deneyenleri yaralayabilir.,
Building.Thorns.DisplayName,Dikenlik,
Building.TributeToIngenuity.DisplayName,Yaratıcılığa Övgü,Name of a monument
Building.TributeToIngenuity.FlavorDescription,"""Elbette bir amacı var. Etkilemeye yarıyor."" —İhtiyar Kazko","Ol' Kazko is a legendary forefather of modern beavers, famous inventor, pioneer of rapid industrialization."
Building.TripleDynamite.DisplayName,Üçlü Dinamit,Dynamite that makes 3 blocks deep hole
Building.TripleFloodgate.DisplayName,Üçlü Bent Kapağı,
Building.TripleFloodgate.FlavorDescription,Biraz daha uzun olsaydı su tutulamayacak kadar ağır hâle gelirdi.,
Building.TripleLodge.Description,Bir sürü kunduza ev sahipliği yapar.,Houses thrice the amounts of beavers as normal lodge
Building.TripleLodge.DisplayName,Üçlü Barınak,
Building.TripleLodge.FlavorDescription,"""Gidip çoğalın,"" Köykuyrukların ciddiye aldığı bir atasözüdür.",Go Forth and multiply is a biblical quote.
Building.TriplePlatform.DisplayName,Üçlü Platform,Triple as triple the height of a normal platform
Building.TriplePlatform.FlavorDescription,Direkleri kemirmek kesinlikle yasaktır!,
Building.Tubeway.Description,Kunduzlar için biraz dar olsa da hızlı bir ulaşım yöntemi.,
Building.Tubeway.DisplayName,Tüp Geçit,"Tubeways are used as a network of large pipes for faster transportation around the map. Departure and arrival  happens in Building.TubewayStation.DisplayName, so they should be named similarly."
Building.Tubeway.FlavorDescription,"Kafa kafaya çarpışan iki kunduzun, en tuhaf Demir Diş icatlarının kaynağı olduğu söylenir.",Hitting your head can be a source of crazy ideas in cartoons. Iron Teeth should be the same as Faction.IronTeeth.DisplayName
Building.TubewayStation.Description,Tüp Geçit ağı girişi ve çıkışı.,
Building.TubewayStation.DisplayName,Tüp Geçit İstasyonu,"Beavers use it to enter Building.Tubeway.DisplayName, so they should be named similarly."
Building.TubewayStation.FlavorDescription,Dar alanlardan korkan kunduzların başka bir yol seçmesi tavsiye edilir.,"Tubeways are very tight corridors, so they wouldn't be accessible for beavers scared of such places."
Building.Tunnel.Description,Arazide bir tünel açar ve onu bir Platformla değiştirir. Arazinin altını veya yapıları görmek için katman aracını kullan.,"Platform is a building, same as Building.Platform.DisplayName"
Building.Tunnel.DisplayName,Tünel,Tunnel is a type of building that - when built - removes a tile of terrain and creates an underground tunnel
Building.UndergroundPile.DisplayName,Yer Altı Yığını,"The underground version of a pile, for reference check Building.SmallPile.DisplayName or Building.LargePile.DisplayName"
Building.UndergroundPile.FlavorDescription,O kadar depolama alanı için bu merdivenleri çıkmaya değer.,
Building.UndergroundRuins.Description,Kazıp çıkarılacak metal hurdalarla dolu gömülü harabeler.,
Building.UndergroundRuins.DisplayName,Yer Altı Harabeleri,Buried ruins on top of which an extracting facility - a mine - can be placed.
Building.UndergroundRuins.FlavorDescription,İnsancıklar burada her ne yapıyorlarsa belli ki çok metal gerektiren bir şeymiş.,
Building.UnstableCore.Description,Eninde sonunda patlayacak eski bir cihaz.,
Building.UnstableCore.DisplayName,Dengesiz Çekirdek,An object that can be placed in map editor that explodes after a set time. Name shouldn't suggest strictly military use or radioactive effect.
Building.VerticalPowerShaft.Description,Enerji aktarır. Yukarı yönlü bağlanabilir.,"Power being mechanical/kinetic, not electricity. Alternative name: axle."
Building.VerticalPowerShaft.DisplayName,Dikey Enerji Mili,"Power being mechanical/kinetic, not electricity. Alternative name: axle."
Building.VerticalPowerShaft.FlavorDescription,Enerji tüketimi arttığında yardımcı olur.,"Power being mechanical/kinetic, not electricity. Alternative name: axle."
Building.VerticalTubeway.Description,Kunduzlar için biraz dar olsa da hızlı bir ulaşım yöntemi. Yukarı yönlü bağlanabilir.,The first sentence must be the same as Building.Tubeway.Description
Building.VerticalTubeway.DisplayName,Dikey Tüp Geçit,"An expanded version of the Building.Tubeway.DisplayName with a solid platform on top of it, that allows other Tubes or structures to be placed on top of it. Tubes are used as a network of large pipes for faster transportation around the map. Departure and arrival happens in Building.TubewayStation.DisplayName, so they should be named similarly."
Building.VerticalTubeway.FlavorDescription,"Sırasıyla yukarı, yukarı, aşağı, aşağı, sola, sağa, sola, sağa, geri, ileri git. Hmm, başladığın yere dönmüşsün.",Konami Code reference
Building.WaterPump.Description,"Kunduzlar için içme suyu pompalar ve filtreler. Bulantı kirliliği, pompalama hızını düşürür.",Badwater should be the same as Good.Badwater.DisplayName. Ideally all uses of the word contaminate/contamination/contaminated should be uniform across the project.
Building.WaterPump.DisplayName,Su Pompası,
Building.WaterPump.FlavorDescription,Bir yudum tatlı su seni kendine getirir.,"""Pumped"" pun, feel free to adapt."
Building.WaterSeep.Description,Sınırlı basınca sahip bir su kaynağı.,
Building.WaterSeep.DisplayName,Su Sızıntısı,"A building that allows water to seep through, creating a natural water source."
Building.WaterSource.DisplayName,Su Kaynağı,
Building.WaterSource.FlavorDescription,"""Nehrin hep aksın."" —Kunduz selamı",
Building.WaterWheel.Description,"Enerji üretir, nehir yatağında akan suya yerleştirilmelidir.",Power is not an electrical but mechanical/kinetic energy.
Building.WaterWheel.DisplayName,Su Değirmeni,
Building.WaterWheel.FlavorDescription,İhtiyar Kazko'nun imza eseri.,"Ol' Kazko is a legendary forefather of modern beavers, famous inventor, pioneer of rapid industrialization."
Building.Weathervane.Description,Rüzgâr yönünü ve kuvvetini gösteren küçük bir pervane.,
Building.Weathervane.DisplayName,Rüzgârgülü,A decoration that turns towards the wind
